,asin,title,description,category,topic_name,bubble_color,bubble_size,clean_link,topic_rank
506,B001CD1HE2,CoFlex Bandaging Wrap,"Co-Flex Bandaging Wrap Easy-to-use cohesive flexible bandage ahheres only to itself, never to hair. ...",other,other_2,0.07625,2,1.0,95
507,B001CD1HE2,CoFlex Bandaging Wrap,"Co-Flex Bandaging Wrap Easy-to-use cohesive flexible bandage ahheres only to itself, never to hair. ...",other,other_2,0.07625,2,1.0,96
512,B001CS0T4Q,Tru-Fit Multi-Purpose Back Brace Black One Size Fits All,Padded Knee Brace Black Large,other,other_2,0.5694714285714285,14,1.0,0
513,B001CS0T4Q,Tru-Fit Multi-Purpose Back Brace Black One Size Fits All,Padded Knee Brace Black Large,other,other_2,0.5694714285714285,14,1.0,1
522,B001DCP5GS, Algae Free Great White Cleaning Magnet (non floating) ,The Algae Free Great White PLUS Cleaning Magnet is one powerful algae cleaning magnet. It has the sa...,other,other_2,0.8946666666666667,3,1.0,31
527,B001DYPAHU,"Dr. Pet Stuffed Animal Storage Bean Bag - Kids Teens Chair over - Extra-Large Toy Organizer - Stuff, Zip, Sit Pouf, Trendy Teenage Bedroom Idea",,other,other_2,0.5392250000000001,4,1.0,13
528,B001DYPAHU,"Dr. Pet Stuffed Animal Storage Bean Bag - Kids Teens Chair over - Extra-Large Toy Organizer - Stuff, Zip, Sit Pouf, Trendy Teenage Bedroom Idea",,other,other_2,0.5392250000000001,4,1.0,14
536,B001EHB0NE,AquaC EV-180 Protein Skimmer with JG fitting,"Opt for modern innovations when it comes to maintaining your aquarium, and get the new AquaC Protein...",other,other_2,0.5831,2,0.0,53
551,B001F95N0W, Tetra Water Wonders Corkscrew Plant 6in ,,other,other_2,0.91355,2,0.0,50
557,B001FB5TP4," Neutrogena Radiance Boost Eye Cream, 0.5 Fluid Ounce (14 g) (Pack of 2)",Neutrogena Radiance Boost Eye Cream 0.5oz,other,other_2,0.69355,2,1.0,47
558,B001FB5TP4," Neutrogena Radiance Boost Eye Cream, 0.5 Fluid Ounce (14 g) (Pack of 2)",Neutrogena Radiance Boost Eye Cream 0.5oz,other,other_2,0.69355,2,1.0,48
564,B001FXJWCI, Black Paw Print 12&quot; Square Tote ,12&quot; square tote.,other,other_2,0.7911,2,1.0,82
565,B001FXJWCI, Black Paw Print 12&quot; Square Tote ,12&quot; square tote.,other,other_2,0.7911,2,1.0,83
572,B001G8PRHQ,"Boxer Uncropped Dog - Linda Picken Treat Jar,BOB"" />",The Ceramic Dog Treat Jar is an amusing canister that holds treats and other pet food. Think of this...,other,other_2,0.76475,2,1.0,79
592,B001K5K2X4,"Lifegard Aquatics Aquamesh Stage 3 Blue Progressive Filter Media, 19&quot;X24&quot;",Lifegard Aquatics AquaMesh Progressive Filter Media- Blue- 19.5&quot; x 24&quot;. Stage #3,other,other_2,0.6941,3,1.0,34
594,B001KKHD0Y,Blue Denim Jean Soft Dog/Cat Harness/Leash ComboMedium,,other,other_2,0.5743,2,1.0,54
595,B001KKHD0Y,Blue Denim Jean Soft Dog/Cat Harness/Leash ComboMedium,,other,other_2,0.5743,2,1.0,55
612,B001MP7K82,Wahl Clipper Lid Skull # 8436-3001,"Fits: Wahl Designer, Super Taper(s), Taper 2000, Pro Basic, 5 Star Magic Clip, Speed Fader, Balding ...",other,other_2,0.8092333333333332,3,1.0,29
633,B001PB36FY,Small Dog Bark Collar Rechargeable - Anti Barking Collar For Small Dogs - Smallest Most Humane Stop Barking Collar - Dog Training No Shock Bark Collar Waterproof - Safe Pet Bark Control Device,"6 pack kennel leads in green, blue, red, black, purple, and yellow",other,other_2,0.7162,2,0.0,90
638,B001PZ1BKM,Ed Geib Gator 10 inch Curved Grooming Shears,Each Geib Gator Shear is manufactured from a high-quality stainless-steel alloy with a Rockwell Hard...,other,other_2,0.8020333333333333,3,1.0,30
650,B001T54VL4,Fallen Heroes Dog Tag - Air Force,Fallen Heroes Dog Tag - Air Force The cost of America's freedom is most dearly paid in the lives of ...,other,other_2,0.7010000000000001,2,1.0,40
652,B001T5AOAG,"Hemp Oil for Dogs and Cats - Full Spectrum Hemp Extract - 250mg - All Natural Pain Relief for Dogs &amp; Cats, Calming, Stress &amp; Anxiety Support, Wellness, Hip &amp; Joint Health - Easily Apply to Treats","Dr. Pet hemp oil for dogs and cats helps your pet overcome separation anxiety, hyperactivity, and ke...",other,other_2,0.52598,5,0.0,9
653,B001T5AOAG,"Hemp Oil for Dogs and Cats - Full Spectrum Hemp Extract - 250mg - All Natural Pain Relief for Dogs &amp; Cats, Calming, Stress &amp; Anxiety Support, Wellness, Hip &amp; Joint Health - Easily Apply to Treats","Dr. Pet hemp oil for dogs and cats helps your pet overcome separation anxiety, hyperactivity, and ke...",other,other_2,0.52598,5,0.0,10
693,B0028BXM6S,Texas A&amp;M Dog Sweater,Turtleneck sweater with embroidered team logo.,other,other_2,0.8358,2,1.0,60
694,B0028BXM6S,Texas A&amp;M Dog Sweater,Turtleneck sweater with embroidered team logo.,other,other_2,0.8358,2,1.0,61
705,B002B5FA1Q,CLAC Fly Repellent Deodorant-Roll-On - 75ml,Natural fly repellent in easy to use roll on dispenser for horses. Perfect for use around horses eye...,other,other_2,0.8088000000000001,3,1.0,24
713,B002DN9GGG,Scottish Terrier Coat Care Grooming Kit FREE BONUS,Now caring for your dog's beautiful coat is easier than ever! We have bundled our best selling items...,other,other_2,0.6093999999999999,2,1.0,58
726,B002HF3YCC,Penn Plax Large Stone-Wort Aquarium Plant,Large Stonewort with heavy weight base. This plant is so realistic your fish wont tell the differenc...,other,other_2,0.31845,2,1.0,84
729,B002HQ6RZM,"Perri's Dotted Stirrup Pads, Black",Black Pad With Extra Grip. For Use In Fillis Irons. Pair,other,other_2,0.70805,2,1.0,97
743,B002LZIKQ8,"LOVATIC Cats Flea and Tick Collar - 8-Month Flea Treatment Cat Collar - Hypoallergenic, Adjustable &amp; Waterproof Tick Prevention - Natural Essential Oil Extracts",,other,other_2,0.206475,4,1.0,17
776,B0035E7NTE,Single Switch Plate Cover - Ceramic Blue Horses,NEW HUMANE TECHNOLOGY WITH OWNER'S VOICE + VIBRATION,other,other_2,0.7444500000000001,2,1.0,98
785,B0036AK3J4,"Gustbuster Navy Golf 68-inch Manual Golf/Rain Umbrella, Solheim Cup","Gustbuster Navy Golf 68-inch Manual Golf/Rain Umbrella, Solheim Cup",other,other_2,0.9089,4,1.0,11
786,B0036AK3J4,"Gustbuster Navy Golf 68-inch Manual Golf/Rain Umbrella, Solheim Cup","Gustbuster Navy Golf 68-inch Manual Golf/Rain Umbrella, Solheim Cup",other,other_2,0.9089,4,1.0,12
794,B0037JK6LE,"Buddy&amp;Max Probiotic Chews for Dogs - Digestive Enzymes - Diarrhea, Stomach, Vomit, Gas, Weight Support, Allergy Relief - Contains Prebiotics - Dog Probiotics Supplement - 130 Chews",<b>PRODUCT DETAILS:</b><br> - All natural organic ingredients<br> - Made in the USA<br> - Improves d...,other,other_2,0.8003,3,1.0,25
796,B0038K6FQ2,"Buddy&amp;Max Probiotic Chews for Dogs - Digestive Enzymes - Diarrhea, Stomach, Vomit, Gas, Weight Support, Allergy Relief - Contains Prebiotics - Dog Probiotics Supplement - 130 Chews",<b>PRODUCT DETAILS:</b><br> - All natural organic ingredients<br> - Made in the USA<br> - Improves d...,other,other_2,0.85765,2,1.0,62
797,B0038K6FQ2,"Buddy&amp;Max Probiotic Chews for Dogs - Digestive Enzymes - Diarrhea, Stomach, Vomit, Gas, Weight Support, Allergy Relief - Contains Prebiotics - Dog Probiotics Supplement - 130 Chews",<b>PRODUCT DETAILS:</b><br> - All natural organic ingredients<br> - Made in the USA<br> - Improves d...,other,other_2,0.85765,2,1.0,63
811,B003D7RJ6U,Big Bow w/ Crystal Ultrasuede Dog Harness - Cheetah - XXS (8&quot;-10&quot; girth),,other,other_2,0.8005,2,1.0,100
816,B003GEZNRM,Mayatex Mayatex Show Saddle Blanket Pad Black Horse Tack 36 X 34 Oversize,Mayatex Mayatex Show Saddle Blanket Pad Black Horse Tack 36 X 34 Oversize : MAYATEX SADDLE BLANKET S...,other,other_2,0.41045,2,1.0,93
817,B003H216JW,"Buddy&amp;Max Probiotic Chews for Dogs - Digestive Enzymes - Diarrhea, Stomach, Vomit, Gas, Weight Support, Allergy Relief - Contains Prebiotics - Dog Probiotics Supplement - 130 Chews",<b>PRODUCT DETAILS:</b><br> - All natural organic ingredients<br> - Made in the USA<br> - Improves d...,other,other_2,0.8011999999999999,2,1.0,49
818,B003H3A04S,Maxell myGEN Portable 500 GB USB 3.0 665220 (Black),The Maxell myGEN USB Portable Hard Drive is a unique and useful hard drive perfect for households wi...,other,other_2,0.7941666666666668,3,1.0,27
819,B003H3A04S,Maxell myGEN Portable 500 GB USB 3.0 665220 (Black),The Maxell myGEN USB Portable Hard Drive is a unique and useful hard drive perfect for households wi...,other,other_2,0.7941666666666668,3,1.0,28
830,B003IPE3SY,Department 56 Snow Village Lost and Found Accessory Figurine,Department 56 Villages set the gold standard for Holiday lit houses. Welcome to The Original Snow Vi...,other,other_2,0.5905,4,1.0,15
831,B003IPE3SY,Department 56 Snow Village Lost and Found Accessory Figurine,Department 56 Villages set the gold standard for Holiday lit houses. Welcome to The Original Snow Vi...,other,other_2,0.5905,4,1.0,16
837,B003K0NBD0,Replacement ramp for Littermaid LM500 and LM900,,other,other_2,-0.20765,2,1.0,41
838,B003K0NBD0,Replacement ramp for Littermaid LM500 and LM900,,other,other_2,-0.20765,2,1.0,42
848,B003LVPTT2,"Fortiflex Feed Saver Ring for Feed Tubs, Black",Versatile feed saver ring made to fit both the cr-750 rubber tub and the fortiflex rf-30 feed tub. i...,other,other_2,0.2367,2,1.0,88
849,B003LVPTT2,"Fortiflex Feed Saver Ring for Feed Tubs, Black",Versatile feed saver ring made to fit both the cr-750 rubber tub and the fortiflex rf-30 feed tub. i...,other,other_2,0.2367,2,1.0,89
884,B003TEFYIW,Petego La Cinopelca Classic Leather Smooth Finish Flat Collar,The quality of this magnificent Italian leather collar can't be rivaled. Crafted in Italy by La Cino...,other,other_2,0.6193,3,1.0,32
18,B000084E4J,"Cream Original Snuggle Ball - 32""",,dog,dog_3,0.75832,5,1.0,55
19,B000084E4J,"Cream Original Snuggle Ball - 32""",,dog,dog_3,0.75832,5,1.0,56
78,B0002AS9T2,"Natural Choice Small Breed Adult Chicken, Whole Brown Rice And Oatmeal Formula - 8 Lbs. (3.63 Kg)","<div class=""aplus""> <div class='rightImage' style='width: 200px;'> <img src='https://images-na.ssl-i...",dog,dog_3,0.6794666666666666,15,1.0,2
79,B0002AS9T2,"Natural Choice Small Breed Adult Chicken, Whole Brown Rice And Oatmeal Formula - 8 Lbs. (3.63 Kg)","<div class=""aplus""> <div class='rightImage' style='width: 200px;'> <img src='https://images-na.ssl-i...",dog,dog_3,0.6794666666666666,15,1.0,3
130,B0002H3XQE,Perla 7 Dog Bed - Green - 40.5 in. x 28 in.x 12.5 in.,"The Perla Bed is an excellent quality molded plastic bed from Italy for dogs or cats.,,",dog,dog_3,0.92755,6,1.0,23
131,B0002H3XQE,Perla 7 Dog Bed - Green - 40.5 in. x 28 in.x 12.5 in.,"The Perla Bed is an excellent quality molded plastic bed from Italy for dogs or cats.,,",dog,dog_3,0.92755,6,1.0,24
138,B0002ML8CA,Newman's Own Organics Adult Dry Dog Food,"For the past 20 years, Newman&#39; s Own Organics has been offering Great Tasting Products That Happ...",dog,dog_3,0.748325,4,1.0,78
139,B0002ML8CA,Newman's Own Organics Adult Dry Dog Food,"For the past 20 years, Newman&#39; s Own Organics has been offering Great Tasting Products That Happ...",dog,dog_3,0.748325,4,1.0,79
142,B0002OST2U,"INCO NCO Bark Collar [2019 Upgraded] No Prongs, No Shock &amp; No Harm - Only Sound &amp; Vibration - Stay in Control with 7 Levels of Intensity - Rechargeable - Most Humane No Bark Collar",",Is your dog super noisy and barks all the time on every sound? But you love your dog and would neve...",dog,dog_3,0.8450333333333333,3,1.0,95
143,B0002OST2U,"INCO NCO Bark Collar [2019 Upgraded] No Prongs, No Shock &amp; No Harm - Only Sound &amp; Vibration - Stay in Control with 7 Levels of Intensity - Rechargeable - Most Humane No Bark Collar",",Is your dog super noisy and barks all the time on every sound? But you love your dog and would neve...",dog,dog_3,0.8450333333333333,3,1.0,96
149,B0002PXU0U,"Charming Pet Heads Pet Squeak Toy, Pig",Wow! Huge squeakers AND a tennis ball in the head AND the thickest pile corduroy available - jackpot...,dog,dog_3,0.5476375,8,1.0,14
164,B0002YFQTE,Scented Creme Rinse - Gallon,Increases manageability and aids in removal of mats and tangles. Makes combing easier. Its long last...,dog,dog_3,0.8510111111111113,9,1.0,11
216,B0006L0X7S,"Precision Pet Products Little Stinker Pickup Pocket Packs for Dogs, 3-Pack, 20 bags per Pack, Opaque Green","Pick Up Bag are Pefect for Walks, Backyards, Dog Parks, Traveling and General Household Use,,",dog,dog_3,0.7328000000000001,3,1.0,97
219,B0006L0WF6,"Pet Voyage Viewer Car Seat, 13"" x 10"" x 7.5"", Gray with Black Trim","Pet Voyage Viewer Car Seat allows your pet pet to be comfortable, yet secure. Fits pets up to 18 pou...",dog,dog_3,0.7889142857142858,7,1.0,17
220,B0006L0WF6,"Pet Voyage Viewer Car Seat, 13"" x 10"" x 7.5"", Gray with Black Trim","Pet Voyage Viewer Car Seat allows your pet pet to be comfortable, yet secure. Fits pets up to 18 pou...",dog,dog_3,0.7889142857142858,7,1.0,18
332,B000BHI090,Lupine 1 inch Bling Bonz Roman Dog Harness,"WLF72261 Size: Small (20"" - 32"") Features: -Adjustable Large Dog Roman Harness.-Material: Jacquard n...",dog,dog_3,0.8963333333333333,3,1.0,98
333,B000BHI090,Lupine 1 inch Bling Bonz Roman Dog Harness,"WLF72261 Size: Small (20"" - 32"") Features: -Adjustable Large Dog Roman Harness.-Material: Jacquard n...",dog,dog_3,0.8963333333333333,3,1.0,99
352,B000BY9AJM,"Cadet Monster Bone Treat/Chew For Dogs, Large, Black",The monster beef all natural femur bone will make an excellent chew/treat for your dog. remember to ...,dog,dog_3,0.8950800000000001,5,1.0,50
353,B000BY9AI8,"Cadet 12&quot; Braided Bully Stick, Pack of 5","12&quot; Brainded Bull Stick, Pack of 5. Cadet Gourmet Braided Bully Stick Natural Dog Chew Treats a...",dog,dog_3,0.73005,6,1.0,30
354,B000BY9AI8,"Cadet 12&quot; Braided Bully Stick, Pack of 5","12&quot; Brainded Bull Stick, Pack of 5. Cadet Gourmet Braided Bully Stick Natural Dog Chew Treats a...",dog,dog_3,0.73005,6,1.0,31
365,B000COE3MK,6PK Pill Pockets EXTRA SMALL Dog 9.6 oz(270 Chicken pockets),"Extra Small has been discontinued, we will substitute with the Small size Pill Pockets",dog,dog_3,0.86828,5,1.0,59
366,B000COE3MK,6PK Pill Pockets EXTRA SMALL Dog 9.6 oz(270 Chicken pockets),"Extra Small has been discontinued, we will substitute with the Small size Pill Pockets",dog,dog_3,0.86828,5,1.0,60
401,B000F9JOM6,Bamboo Quick Control 6-Foot Leash with Seat Belt Latch Black,The Quick Control collar has comfort padded handle with a built in leash for control when you need i...,dog,dog_3,0.4450699999999999,10,1.0,9
402,B000F9JOM6,Bamboo Quick Control 6-Foot Leash with Seat Belt Latch Black,The Quick Control collar has comfort padded handle with a built in leash for control when you need i...,dog,dog_3,0.4450699999999999,10,1.0,10
411,B000FNJ616,8 in 1 J-1803 4 Oz Itch Relief Hydrocortisone Pet Spray,"Itch relief hydrocortisone spray for quick effective results, relieves itching. Helps sooth skin irr...",dog,dog_3,-0.5176,3,1.0,92
412,B000FNJ616,8 in 1 J-1803 4 Oz Itch Relief Hydrocortisone Pet Spray,"Itch relief hydrocortisone spray for quick effective results, relieves itching. Helps sooth skin irr...",dog,dog_3,-0.5176,3,1.0,93
519,B000J2JKIC,Dogswell Happy Hips Duck Breast Dog Treats with Glucosamine &amp; Chondroitin (5 oz.),"Product Highlight(s):All-Natural, Cage-Free Chicken Breast Functional BenefitsAntioxidants Glucosami...",dog,dog_3,0.6962333333333334,6,1.0,32
520,B000J2JKIC,Dogswell Happy Hips Duck Breast Dog Treats with Glucosamine &amp; Chondroitin (5 oz.),"Product Highlight(s):All-Natural, Cage-Free Chicken Breast Functional BenefitsAntioxidants Glucosami...",dog,dog_3,0.6962333333333334,6,1.0,33
536,B000JHK2VG,24&quot;H x 24&quot; 10 Panel GoGo Black Epoxy Exercise Pen w/ Door,Ten 2' panels. each pen comes with a carrying handle for easy transport. guaranteed top quality!,dog,dog_3,0.9326666666666666,6,1.0,25
575,B000NE2W6I,John Paul Pet Super Bright Shampoo 475ml,This extraordinary formula has been developed for light coloured coats. It helps control matting  ta...,dog,dog_3,0.8500375000000001,8,0.0,12
691,B000W71VRC,Leather Brothers Dog Hunting Collar,"Collars and harnesses made by this company are measured to the end of the strap, not to the last hol...",dog,dog_3,0.4982,4,1.0,90
692,B000W71VRC,Leather Brothers Dog Hunting Collar,"Collars and harnesses made by this company are measured to the end of the strap, not to the last hol...",dog,dog_3,0.4982,4,1.0,91
733,B000X888JO,Black 1&quot;&quot; Traffic Lead w/ Rubber Handle 12&quot;&quot;,,dog,dog_3,0.8394,5,1.0,48
734,B000X888JO,Black 1&quot;&quot; Traffic Lead w/ Rubber Handle 12&quot;&quot;,,dog,dog_3,0.8394,5,1.0,49
749,B000Y1G662,Comfort Pet Products Premium Pillow,"Comfort Pet Products Premium Pillow 30X24, Tan",dog,dog_3,0.6181,5,1.0,57
750,B000Y1G662,Comfort Pet Products Premium Pillow,"Comfort Pet Products Premium Pillow 30X24, Tan",dog,dog_3,0.6181,5,1.0,58
795,B0012KMGBI,"Dog Room Cage Dog Crate, Brown + Receive a FREE ABC Pet Plaza Dog Calendar w/Purchase","This commercial grade crate is perfect for small dogs and puppies for training. 
Outside Size: 36""W ...",dog,dog_3,0.9094833333333332,6,1.0,28
796,B0012KMGBI,"Dog Room Cage Dog Crate, Brown + Receive a FREE ABC Pet Plaza Dog Calendar w/Purchase","This commercial grade crate is perfect for small dogs and puppies for training. 
Outside Size: 36""W ...",dog,dog_3,0.9094833333333332,6,1.0,29
831,B00166KEZ8,"Pawious Bark Collar - [Newest 2019] Rechargeable Anti Bark Collar for Small Medium Large Dogs - Beep, Vibration, Harmless Shock, Waterproof Dog Barking Collar",",Is your dog super noisy and barks all the time on every sound? But you love your dog and would neve...",dog,dog_3,0.82962,5,1.0,51
832,B00166KEZ8,"Pawious Bark Collar - [Newest 2019] Rechargeable Anti Bark Collar for Small Medium Large Dogs - Beep, Vibration, Harmless Shock, Waterproof Dog Barking Collar",",Is your dog super noisy and barks all the time on every sound? But you love your dog and would neve...",dog,dog_3,0.82962,5,1.0,52
898,B001BJCMMS,Furminator DeShedding Tool (LARGE) with FREE Shampoo,FURminator is a specially designed pet grooming brush. The secret to the FURminator treatment is a p...,dog,dog_3,0.9640666666666666,3,0.0,94
923,B001FBCW18,"PPP Pet Aroma Care Chamomile Shampoo, 13-1/2-Ounce",This soothing shampoo will gently condition and balance the skin while deodorizing and conditioning ...,dog,dog_3,0.7087857142857145,7,1.0,21
924,B001FBCW18,"PPP Pet Aroma Care Chamomile Shampoo, 13-1/2-Ounce",This soothing shampoo will gently condition and balance the skin while deodorizing and conditioning ...,dog,dog_3,0.7087857142857145,7,1.0,22
927,B001FBFZPI," PPP Pet Aroma Care Conditioning Cactus Shampoo, 13-1/2-Ounce"" />",This luxurious natural cactus and aloe shampoo contains the finest ingredients for a soothing and co...,dog,dog_3,0.88255,10,1.0,6
928,B001FBFZPI," PPP Pet Aroma Care Conditioning Cactus Shampoo, 13-1/2-Ounce"" />",This luxurious natural cactus and aloe shampoo contains the finest ingredients for a soothing and co...,dog,dog_3,0.88255,10,1.0,7
942,B001GS71LQ,"Precision Pet 30 x 40 SnooZZy Cozy Comforter Pet Pillow in Hearts and Waves, Caramel","Comfort pets in hearts & waves with this unique, embossed micro-plush bed. Offering long-lasting com...",dog,dog_3,0.79215,6,1.0,26
943,B001GS71LQ,"Precision Pet 30 x 40 SnooZZy Cozy Comforter Pet Pillow in Hearts and Waves, Caramel","Comfort pets in hearts & waves with this unique, embossed micro-plush bed. Offering long-lasting com...",dog,dog_3,0.79215,6,1.0,27
980,B001L49W4O,"Herm. Sprenger X-Heavy Chain Training Collar, 4.00 mm","Our Herm. Sprenger Dog Chain Training Collar is a safe, effective training tool with proper use. Sop...",dog,dog_3,0.39215,6,1.0,45
1083,B001WJNWDK,ORE Pet Black &amp; White Two Tone Large Pet Food Scoop,ORE originals has been creating a legacy of happy products for good people and pets since 1989. It a...,dog,dog_3,0.864025,4,1.0,70
1084,B001WJNWDK,ORE Pet Black &amp; White Two Tone Large Pet Food Scoop,ORE originals has been creating a legacy of happy products for good people and pets since 1989. It a...,dog,dog_3,0.864025,4,1.0,71
1291,B003ODB888,Zuke'S Jerky Naturals Treats Lamb 6oz,"Zuke'S Jerky Naturals Dog Treats Tender Lamb Recipe - 6 Ounce, Pack Of 2",dog,dog_3,0.7446666666666667,6,0.0,43
1292,B003ODB888,Zuke'S Jerky Naturals Treats Lamb 6oz,"Zuke'S Jerky Naturals Dog Treats Tender Lamb Recipe - 6 Ounce, Pack Of 2",dog,dog_3,0.7446666666666667,6,0.0,44
1316,B003SLV642,Sentry Worm X Plus Medium - Large Dog De-Wormer 12 Flavored Chewable Tablets,"WormX Plus De-Wormer Chewables are used for the treatment and control of roundworms, hookworms and t...",dog,dog_3,0.4458499999999999,4,0.0,68
1317,B003SLV642,Sentry Worm X Plus Medium - Large Dog De-Wormer 12 Flavored Chewable Tablets,"WormX Plus De-Wormer Chewables are used for the treatment and control of roundworms, hookworms and t...",dog,dog_3,0.4458499999999999,4,0.0,69
1333,B003TA2O9S,Wahl Chromado Professional Cord/Cordless Pet Clipper Kit,Wahl Chromado Professional Cord/Cordless Pet Clipper Ki,dog,dog_3,0.708575,4,0.0,74
1334,B003TA2O9S,Wahl Chromado Professional Cord/Cordless Pet Clipper Kit,Wahl Chromado Professional Cord/Cordless Pet Clipper Ki,dog,dog_3,0.708575,4,0.0,75
1342,B003TL7XFM,"Ancol Muddy Paws Greyhound Whippet Coat, L, Black",The Ancol Greyhound and Whippet Dog Coat had been specially designed to keep your canine warm in all...,dog,dog_3,0.6360750000000001,4,1.0,86
1343,B003TL7XFM,"Ancol Muddy Paws Greyhound Whippet Coat, L, Black",The Ancol Greyhound and Whippet Dog Coat had been specially designed to keep your canine warm in all...,dog,dog_3,0.6360750000000001,4,1.0,87
1357,B003UR6L0S,Snoozer- Bolster Bed - Extra Large,"Made specifically to provide maximum comfort for your pet while resting, the Snoozer Round Bolster p...",dog,dog_3,0.7381166666666666,6,1.0,34
1358,B003UR6L0S,Snoozer- Bolster Bed - Extra Large,"Made specifically to provide maximum comfort for your pet while resting, the Snoozer Round Bolster p...",dog,dog_3,0.7381166666666666,6,1.0,35
1436,B004AHGCAG,"Lazer Brite Reflective Adjustable Collar, 3/8&quot;",Our Lazer Brite Reflective Adjustable Dog Collar features reflective material visible up to 600 feet...,dog,dog_3,0.8226833333333333,6,1.0,41
1437,B004AHGCAG,"Lazer Brite Reflective Adjustable Collar, 3/8&quot;",Our Lazer Brite Reflective Adjustable Dog Collar features reflective material visible up to 600 feet...,dog,dog_3,0.8226833333333333,6,1.0,42
1483,B004LO7LVC,Petrodex Neon Toothbrush,To help keep your pets teeth clean.    Plastic Bristles,dog,dog_3,0.50715,4,1.0,77
1525,B004WLQ5YI,"Dean and Tyler DT Track Nylon Tracking Leash, Black 20-Feet by 3/4-Inch with Solid Brass Hardware",Dean and tyler nylon track dog leash high quality strong nylon from europe black 20-Feet by 3/4-Inch...,dog,dog_3,0.5956,5,1.0,53
1526,B004WLQ5YI,"Dean and Tyler DT Track Nylon Tracking Leash, Black 20-Feet by 3/4-Inch with Solid Brass Hardware",Dean and tyler nylon track dog leash high quality strong nylon from europe black 20-Feet by 3/4-Inch...,dog,dog_3,0.5956,5,1.0,54
1562,B00501JS6G,"Ader Enterprises Pet Vision Pet Vision Pro, 8ml","Pet Vision is formulated to treat incipient cataracts, immature cataracts, nuclear sclerosis, and dr...",dog,dog_3,0.2161999999999999,7,1.0,19
1563,B00501JS6G,"Ader Enterprises Pet Vision Pet Vision Pro, 8ml","Pet Vision is formulated to treat incipient cataracts, immature cataracts, nuclear sclerosis, and dr...",dog,dog_3,0.2161999999999999,7,1.0,20
1656,B0058NEMT4,"Darford Zero G Food For Dogs With Turkey And Chicken, 15-Pound",Darford Zero G Food For Dogs with Turkey and Chicken is made with a unique low glycemic blend of buc...,dog,dog_3,0.877275,4,1.0,66
1657,B0058NEMT4,"Darford Zero G Food For Dogs With Turkey And Chicken, 15-Pound",Darford Zero G Food For Dogs with Turkey and Chicken is made with a unique low glycemic blend of buc...,dog,dog_3,0.877275,4,1.0,67
1687,B005E1M85A,Bass Brushes Alternating Short and Long Tooth Metal Pet Comb with Bamboo Wood Handle,Alternating Short and Long Tooth Metal Comb with One Hundred Percent Bamboo Handle and Rubber Grip B...,dog,dog_3,0.7174333333333333,6,1.0,40
1717,B005HJ8SOY,Warner Arctic Sleigh Bells Decorative Leather Strap Door Bell 28&rdquo; With 10 Silver Plated Jingle,Decorative Door Bell 28 Leather With 10 Silver-Plated Sleigh Bells This 28 long by 1 wide handcrafte...,dog,dog_3,0.5309208333333334,24,1.0,0
1718,B005HJ8SOY,Warner Arctic Sleigh Bells Decorative Leather Strap Door Bell 28&rdquo; With 10 Silver Plated Jingle,Decorative Door Bell 28 Leather With 10 Silver-Plated Sleigh Bells This 28 long by 1 wide handcrafte...,dog,dog_3,0.5309208333333334,24,1.0,1
1742,B005MZ5YE0,"East Side Collection Acrylic Spirit Dog Sweater, Polka Dot, Small/Medium, 14-Inch","This cheerful spirit dog sweater is adorned with pom poms and a polka dot pattern. Warm, comfy and f...",dog,dog_3,0.8210000000000001,4,1.0,80
1743,B005MZ5YE0,"East Side Collection Acrylic Spirit Dog Sweater, Polka Dot, Small/Medium, 14-Inch","This cheerful spirit dog sweater is adorned with pom poms and a polka dot pattern. Warm, comfy and f...",dog,dog_3,0.8210000000000001,4,1.0,81
1780,B005USG588,"Rogz Fancy Dress Extra Large 1&quot; Armed Response Side-Release Fashion Dog Collar, Pink Bone Design",This is the elite range for larger than life dogs who demand good looks along with strength and qual...,dog,dog_3,0.47424,5,1.0,63
1804,B0064FWPHQ,Red Barn 6 in Large Filled Bone Beef 15 ct case,We took a dogs favorite thing--a bone and stuffed it with a delicious filling. It is natural for dog...,dog,dog_3,0.6438200000000001,5,1.0,61
1805,B0064FWPHQ,Red Barn 6 in Large Filled Bone Beef 15 ct case,We took a dogs favorite thing--a bone and stuffed it with a delicious filling. It is natural for dog...,dog,dog_3,0.6438200000000001,5,1.0,62
1808,B0064FWQ3E,Red Barn 6in Large Filled Bone Peanut Butter 15ct case,"We took a dog's favorite thing--a bone, and stuffed it with a delicious filling. It is natural for d...",dog,dog_3,0.7258666666666667,6,0.0,38
