,asin,title,description,category,topic_name,bubble_color,bubble_size,clean_link,topic_rank
193,B00061UPOY,MATENIX Donkey Pinata 834; (Treat Filled) Bird Toy,Our Polly Wanna Pinata is a Bi...,bird,bird_0,0.39701,10,0,20
16,B0002AQD1I,Zoo Med Daylight Blue Incandescent Reptile Bulb 15 Watts,Zoo Meds Daylight Blue Reptile...,amphibians and reptiles,amphibians and reptiles_1,0.0883,3,1,20
894,B002YOTW7M,"Nutrafin Max Gammarus Pellets, 12-Ounce",Nutrafin Max Turtle Gammarus S...,amphibians and reptiles,amphibians and reptiles_0,0.5634714285714286,7,1,20
162,B0002ATCZM,Dazzle Stones Aquarium Floor Decoration,Dazzle Stones Multi. 0.50 LB. ...,fish,fish_3,0.8432,1,1,20
61,B0002AQKKC,"Fluval Zeo-Carb, 150 Gram, 3-Pack Nylon Bags",Fluval Zeo-Carb is a premium b...,fish,fish_4,0.5242859999999996,100,1,20
246,B000EUCHSY,"Go! Dry Cat Food, Natural Chicken, Fruit And Vegetables Formula, 8-Pound Bag","Go Dry Cat Food, Natural Chick...",cat,cat_3,0.7242500000000001,2,1,20
3835,B005TKCWZW,Up Country Snowman Collar - Large,<b>Your Dog's Winter Companion...,dog,dog_2,0.6775499999999999,10,1,20
573,B001LX4E52,"Buddy&amp;Max Probiotic Chews for Dogs - Digestive Enzymes - Diarrhea, Stomach, Vomit, Gas, Weight Support, Allergy Relief - Contains Prebiotics - Dog Probiotics Supplement - 130 Chews",<b>PRODUCT DETAILS:</b><br> - ...,other,other_3,0.7667666666666667,3,1,20
171,B0002DHK30,Sun Seed Company Animal Lovens Petzel Stix 3.5oz,Crunchy oven baked treats idea...,rabbits and rodents,rabbits and rodents_3,0.7527999999999999,2,1,20
280,B000ES7WIQ,"Chris Christensen Buttercomb All Fine Pet Comb, 7.5""",For breeds that don't need the...,other,other_6,0.5022500000000001,4,1,20
50,B0002AQBUQ,"Zoo Med Habba Hut, Giant",This is a natural alternative ...,amphibians and reptiles,amphibians and reptiles_2,0.4776866666666666,90,1,20
37,B0002AQ2LY,Penn Plax Bubbler Bottom Filter,"A simple, efficient filter for...",fish,fish_1,0.4369599999999999,15,1,20
10293,B00ENAZ6X4,"Near &amp; Dear Pet Memorials Elite Cloisonn&eacute; Floral Blush Pet Cremation Urn, 50 Cubic Inch, Pink",The Near and Dear Elite Cloiso...,cat,cat_0,0.71299375,16,1,20
246,B0002DIDR2,AquaClear Suction Cup Bracket for Powerhead Pumps,This suction cup bracket is us...,other,other_0,0.6914363636363636,11,1,20
553,B001HGETEO,"Buddy&amp;Max Probiotic Chews for Dogs - Digestive Enzymes - Diarrhea, Stomach, Vomit, Gas, Weight Support, Allergy Relief - Contains Prebiotics - Dog Probiotics Supplement - 130 Chews",<b>PRODUCT DETAILS:</b><br> - ...,other,other_5,0.5178666666666666,3,1,20
159,B0002DI6QU,Jungle Talk Garden Kabob,",A great fruit and vegetable h...",bird,bird_4,0.9672,1,1,20
138,B0002DGIL0,"MatrixCarbon, 4 L / 1 gal.",MatrixCarbon is a truly unique...,fish,fish_6,0.5680000000000001,6,1,20
616,B000KK0DYS,TORRIX Cats Flea and Tick Collar  8-Month Flea Prevention Cat Collar  Adjustable and Waterproof Cat Flea and Tick Control,",Torrix pet collar is an excel...",cat,cat_1,0.5382,4,0,20
8,B0002AQWPK,MARCHIORO CAGE:TOMMY 120 BEIGE/GREEN,...,rabbits and rodents,rabbits and rodents_2,0.4101285714285714,7,1,20
33,B0002AQ9EY,Zoo Med Screen Cover With Door for 10 Gallon Tanks,Zoo Meds Screen Covers feature...,amphibians and reptiles,amphibians and reptiles_4,0.2672076923076922,13,1,20
220,B0002Z7UBA,StopWoofer Humane Bark Collar-Dog bark Collar-Anti Barking Collar Small Dogs Medium Large Dogs-Rechargeable Waterproof Anti bark Collar-No bark Collars Sound Warning Vibration Electric Stimulation,<b>?Why do you need anti-bark ...,fish,fish_5,0.7886,1,0,20
5233,B00M4Q4HDO,"Northfin Fish Food, 3 mm Sinking Pellets, 500 g, Cichlid Formula",NorthFin's Cichlid formula is ...,fish,fish_0,0.7321166666666667,12,1,20
148,B0002BIO6O,Brand New Parrot Bird Wrought Iron Cage Dome-Top On Wheels 24x20x60 HGN,Parrot Bird Wrought Iron Cage ...,bird,bird_1,0.7269,1,1,20
63,B0002AS7OY,Kaytee Color Nest Hide Tunnel,Kaytee Color Nests and Mats ar...,rabbits and rodents,rabbits and rodents_1,0.6249,1,0,20
577,B001CS0YK0,Fiebing's Company Saddle Soap Paste,Fiebing s saddle soap is used ...,other,other_4,0.8134,3,1,20
91,B0002DIDDQ,MarineLand PR1550 4-Pack Aquarium Inlet/Outlet O-Ring Replacement for HOT Magnum Power Filter Model PC250,Marineland O-ring is a replace...,other,other_2,0.4986,4,0,20
2269,B009I1SKOU,County Brook Design Martingale Heavyduty Nylon Dog Collar-Black-XL,...,dog,dog_5,0.8720833333333333,6,0,20
527,B001F9AHX0,ML IMPELLER MAGNET ONLY MAG350,Replacement Magnet Assembly fo...,other,other_1,0.5577,3,1,20
6,9789883080,HQ 22x17 Dome Top Bird Cage and Rolling Stand w Shelf Black,Removable tray Removable grate...,bird,bird_3,0.8881,2,1,20
9150,B019ELD11K,"Recovery Food, Sherwood SARx PLUS for Rabbits - soy-free (compare to 'Critical Care')",A scientifically formulated co...,rabbits and rodents,rabbits and rodents_0,0.7518999999999999,11,1,20
42289,B00YG4WJY6,DogGi New Item Jiu Jitsu Judo Karate Martial Arts Dog Gi Kimono,MARTIAL ARTS GI FOR DOGS...,dog,dog_0,0.72056,20,1,20
259,B0002Z7W40,Dainichi KOI - GROWTH-PLUS (1.1 lb) Bag - Medium Pellet,Features:GROWTH PLUS is our sp...,fish,fish_3,0.7845,1,0,21
52,B0002APRZG,"Python 18"" Koi Inspection Net Head",KOI INSPECTION NET HEAD 22' FL...,fish,fish_4,0.0807333333333333,3,1,21
761,B001JYDBEI,Veterinus Derma Gel 100ml (3.4 fl.oz),Veterinus Derma Gel 100ml (3.4...,farm animals,farm animals_0,0.3365999999999999,12,1,21
55,B0002AQ31I,24' Adjustable Latex Perch for Small Birds thru Cockatiels,...,bird,bird_6,0.43595,2,1,21
4,B000084EMZ,"TetraPond Pond Sticks, Healthy Nutrition for Goldfish and Koi","For 50 years, fishkeeping enth...",fish,fish_6,0.5929096858638737,382,1,21
7,B0002A5Z7G,"Lee's Deluxe Turtle Lagoon, Oval w/Tray and Plant, 11-Inch by 8-1/2-Inch by 3-1/4-Inch",Lee's Turtle Lagoons are the p...,amphibians and reptiles,amphibians and reptiles_1,0.20325,18,1,21
27944,B00S5HAVVI,Aquatic Experts Filter Socks 200 Micron - 4 Inch Ring by 14 Inch Long &ndash; 24 Pack- Long - Premium Aquarium Felt Filter Bags - Custom Made in The USA,"<b>""solid construction""""would ...",other,other_0,0.6183363636363637,11,1,21
168,B0002DGQ44,Swinging Bird w/ Perch,Swining birds with perch....,bird,bird_2,0.9241,1,1,21
236,B0002DJVZU,JW Pet Company Insight Sand U Perch Regular,JW Pet Company Insight Sand U ...,bird,bird_4,0.9285,1,1,21
370,B000VDX7EC,"Fancy Feast Salmon &amp; Shrimp Feast Cat Food, 3 oz","Fancy Feast 3 OZ, Classic Shri...",cat,cat_3,0.54785,2,1,21
148,B000AQSTOI,M&amp;C Milky Flake-Ums For Kittens,Milky Flake-UMs Treats help to...,cat,cat_6,0.88575,2,1,21
445,B00176ALUU,Mounting Legs for Coralife Aqualight Pro,Mounting Legs for the Aqualigh...,other,other_2,0.6933,4,1,21
923,B001FBCW18,"PPP Pet Aroma Care Chamomile Shampoo, 13-1/2-Ounce",This soothing shampoo will gen...,dog,dog_3,0.7087857142857145,7,1,21
108,B0002AQMJQ,"PondCare 149B Ammo Rocks, 10-Pound Bag",The perfect biological filter ...,fish,fish_5,0.9381,1,0,21
31,B0002APV7K,"Lee's 5-1/2 Economy Undergravel Filter, 1 Plate, 8-Inch by 16-Inch",Lee's Economy Undergravel Filt...,fish,fish_2,0.3853,5,1,21
285,B0002FP3NW,Goldenfeast Treat Petite 25oz Bird Treat,Treat Petite For All small Hoo...,bird,bird_1,0.8588,1,1,21
4761,B0085FEDDC,"Mirage Pet Products Christmas Stars Smoocher, X-Large",Mirage is a pet products manuf...,dog,dog_1,0.8293375000000001,8,1,21
35468,B00RDKQS9M,"(3 Pack) Grandma Lucy's Organic Oven Baked Pumpkin Dog Treats, 14 Ounces each",Grandma Lucy&apos;s Organic Ov...,dog,dog_0,0.6455050000000001,20,1,21
686,B000EFVA6Y,Pet Supply Imports - Kitty Connector Tee,Rainbow Kitty Connector Tee 13...,cat,cat_2,0.8835000000000001,5,1,21
11,B000256688,Lifegard Aquatics 4-Inch by 6-Inch White Algae Pad,Surface friendly Algae Scrub P...,rabbits and rodents,rabbits and rodents_6,0.4622083333333333,12,1,21
297,B000NGQJ0G,"INCO NCO Bark Collar [2019 Upgraded] No Prongs, No Shock &amp; No Harm - Only Sound &amp; Vibration - Stay in Control with 7 Levels of Intensity - Rechargeable - Most Humane No Bark Collar",",Is your dog super noisy and b...",other,other_1,0.2981,3,0,21
158,B0002IPJ3I,Sandia Pet Products Neon Green Ferret Harness with Bell,"Top quality, adjustable nylon ...",rabbits and rodents,rabbits and rodents_5,0.5148571428571428,14,1,21
39,B0000AH9XL,Friskies Special Diet Chicken and Gravy (24/5.5-oz cans),Friskies Special Diet Meaty Bi...,cat,cat_5,0.1822333333333333,3,1,21
2,B000255NH8,API Algae Scraper for Glass Aquariums 1-Count Container,API ALGAE SCRAPER GLASS uses a...,fish,fish_1,0.4619023809523808,126,1,21
142,B0002YFAUO,Orchard Apple Treats - 2 pack,"Unique new treat. Healthy, fun...",rabbits and rodents,rabbits and rodents_1,0.6467,1,1,21
14039,B00CHSVZPW,"Best Pet All Season Pet Harness, Medium, Pink",This all season harness is mad...,dog,dog_6,0.5042923076923077,13,1,21
324,B000HHQ2DU,"Miller Co Enclosed Feed Scoop, 3 Quart, Black","MILLER CO Enclosed Feed Scoop,...",other,other_6,0.7766000000000001,4,1,21
33,B0002A5AR6,Dr.Daniels Products Catnip Cushion Toy,Assorted colorful designed 2 1...,cat,cat_4,0.863,2,1,21
13837,B00NFC3DCW,Holographic Emotional Support Animal Feline | Cat ID,...,cat,cat_0,0.56565625,16,1,21
28,B0000CET3P,Animalovens Pretzel Sticks Food - Net Wt 3.5 OZ,Animalovens Pretzel Sticks Foo...,rabbits and rodents,rabbits and rodents_4,0.4226333333333333,3,1,21
199,B0002DIXRM,[NEW 2019] Humane Bark collar-Dog bark Collar-Anti Barking Collar Small Dogs Medium Large Dogs-Rechargeable Waterproof Anti bark Collar-No bark Collars Sound Warning Vibration Electric Stimulation,<b>?Why do you need anti-bark ...,bird,bird_4,0.9186,1,1,22
16669,B00ESAZYV8,Lupine 1 Inch Shadow Hunter Dog Lead,All Lupine products are proudl...,dog,dog_0,0.66834,20,1,22
15803,B00VB91ID2,ONMOG Flea and Tick Prevention Collar for Cat &ndash; Best Flea Collar Repellent &ndash; 8 Month Protection &ndash; Environment Friendly with Fully Natural Ingredients,"As you know, the flea and tick...",cat,cat_0,0.6552333333333334,15,0,22
1008,B002SSGOJI,Natural Chicken Meal and Brown Rice Adult Formula Dry Dog Food for Large Breeds,Since Breeder's Choice began i...,dog,dog_5,0.7033,6,1,22
24,B00025YS1K,Royal Pet Supplies Inc Zoo Med Natural Iguana Food Formula,Zoo Meds new Natural Juvenile ...,amphibians and reptiles,amphibians and reptiles_2,0.50735625,32,1,22
194,B0002DIZ3O,Prevue Pet Products Small Animal Hamster Space Tunnel,Great place to run and hide. B...,rabbits and rodents,rabbits and rodents_3,0.9952,1,0,22
7493,B004K2IAVA,"Precise Holistic Complete, Wild At Heart Formula, Duck And Turkey Food For Dogs, 30 Pound Bag",PRECISE HOLISTIC COMPLETE Wild...,dog,dog_6,0.8452000000000002,12,1,22
3,B000255MX8,"Aquarium Pharmaceuticals RENA Cal Basic Heater 14 inch, 300W",For 55 to 100 gallon aquariums...,fish,fish_3,0.8966,1,0,22
27,B0002APIX2,Four Paws Pet Products Ez Lock Screen Cover 30 Inch,Four Paws Safety Screen Covers...,rabbits and rodents,rabbits and rodents_1,0.5940090909090907,110,1,22
545,B00079SVF0,Halo Liv-A-Littles Whole Chicken Treats 2.5 oz.,"please check the photo,,...",cat,cat_2,0.61574,5,1,22
31,B00025K0US,Tetra TetraMarine Large Saltwater Flakes for all Marine Fish,"For 50 year, fishkeeping enthu...",fish,fish_4,0.563614705882353,68,1,22
20,9828397498,Bella BirdCo Super Stepper,...,bird,bird_3,0.74855,2,0,22
117,B0002ASV1I,LM Animal Farms Bonanza Parrot 20lb,L/M Animal Farms Bonanza Bount...,bird,bird_2,0.5916,1,1,22
1683,B002DVTIOI," Spectrastone Special Red Aquarium Gravel for Freshwater Aquariums, 25-Pound Bag ",Red aquarium gravel for freshw...,fish,fish_0,0.6034333333333334,12,1,22
54,B0002DHQR0,"AquaClear 50 Nylon Bag, 2-Pack",The AquaClear Filter Media Bag...,fish,fish_1,0.4689591836734694,49,1,22
27,B0002VXEBY,Crittertrail Mini One,Completely Connectable. The fo...,rabbits and rodents,rabbits and rodents_2,0.0243499999999999,2,1,22
525,B0018CE6M2,Eheim AEH7276650 Canister O-Ring 2250/60 for Aquarium Water Pump,Eheim rings are used extensive...,other,other_4,0.3141333333333333,3,1,22
145,B00061UWFG,"Super Bird Creations 9-1/2 by 2-Inch Whiskers Bird Toy, Large",Tightly rolled paper lollipop ...,other,other_2,0.4965999999999999,3,1,22
113,B0002AQNZ4,Aquarium Pharmaceuticals Aquarian Goldfish Flake Fish Food 6.74oz,Provides superior nutrition fo...,fish,fish_5,-0.8442,1,0,22
99,B0002IEQSM,Cat Bed in the Sky - Cat Furniture Scratching Post with Sisal,Heavy Duty scratching post wit...,cat,cat_3,0.9857,1,1,22
80,B0002DJL0K,Marshall Pet Products Super Thru-Way,The Marshall super thruway is ...,rabbits and rodents,rabbits and rodents_6,0.6213501018329942,491,1,22
2,B00005OMWZ,"Castor &amp; Pollux Curious Cat Organic Catnip, 1 Ounce","<P><STRONG>""We make stuff we l...",cat,cat_5,0.6191666666666666,3,1,22
397,B000BN82J2,Natural Balance Chicken &amp; Liver Pate Formula Ultra Premium Canned Cat Food,Cats are carnivores! Treat you...,cat,cat_1,0.622425,4,1,22
18,B000255PDA,Seachem Marine Buffer 1 Kilo,Marine Buffer will Safely rais...,fish,fish_6,0.4274904761904762,21,1,22
149,B0002JEJPQ,"Equilibrium, 4 kg / 8.8 lbs",Equilibrium? is specifically d...,other,other_6,0.5094000000000001,4,1,22
62,B0002DHKI0,"Spectrastone Special Black Aquarium Gravel for Freshwater Aquariums, 25-Pound Bag",Black aquarium gravel for fres...,fish,fish_2,0.3073318181818181,22,1,22
6664,B00L0UBFUI,Shrimp King - Complete,",Main food,Feed pads for daily...",rabbits and rodents,rabbits and rodents_0,0.6487454545454545,11,1,22
231,B000P8DVL2,Palm Tree Cat Climber,...,cat,cat_6,0.9913,1,0,22
0,0982083513,Piece of Pie A La Mode,Softcover book of 46 pages wit...,other,other_5,0.6221333333333333,3,1,22
13,B0002APZP8,"Lee's Reptile Ranch, Round w/Lid",The Lee's Stackable Reptile Ra...,amphibians and reptiles,amphibians and reptiles_1,0.3117333333333333,3,1,22
5286,B018QQ1PGW,Thomas Moore Feed TMF Songbird Mix Bird Seed,Thomas Moore Feed Songbird Mix...,bird,bird_0,0.54281,10,1,22
34,B000255P6W,"Pretty Bird International Bpb79310 Species Specific Hi-Pro Special Cockatoo And Amazon Food For Birds, 20-Pound",Pretty Bird Hi-Pro special foo...,bird,bird_1,0.9081,1,1,22
276,B000E1R4TK,Itty Bitty Buddy Biscuits - 8 oz - Peanut Butter Madness,Your pet will love these great...,other,other_3,0.9320666666666668,3,1,22
103,B0002URAGA,"Precise 726019 Canine Foundation Dry Food For Pets, 40-Pound",Precise Chicken Meal &amp; Ric...,dog,dog_4,0.7839833333333334,6,1,22
2065,B00PNXVUAS,"Carolina Giant Half Log, Reptile Habitat Accessory","The Carolina Giant Half Log, R...",amphibians and reptiles,amphibians and reptiles_0,0.7279714285714285,7,0,22
5680,B00BR3HJSU,Lupine 1-Inch Flower Box Adjustable Dog Collar,All Lupine products are proudl...,dog,dog_2,0.68464,10,1,22
18,B0002APUSK,"Lee's Premium Zeolite Cartridge, Disposable, 2-Pack",Lee's Premium Disposable Zeoli...,amphibians and reptiles,amphibians and reptiles_4,0.0,2,1,22
112,B0002DGN9W,BOBBING BIRD/PRCH,"Bobbing Bird with Perch,,...",bird,bird_4,-0.3291,1,1,23
16,B000256EL2,Natural Chemistry Healthy Habitat,Healthy Habitat is a cleaner a...,rabbits and rodents,rabbits and rodents_5,0.6560728571428571,140,1,23
192,B0002DIUMU,"Prevue Pet Products SPV2041 Plastic Hideout Hamster Hut, Colors Vary",Prevue Pet hideout hamster hut...,rabbits and rodents,rabbits and rodents_3,0.9623,1,1,23
233,B000RIA9CE,"Synovi-Feline Granules, 240 Gram Container",Synovi-Feline is a complete fe...,cat,cat_4,0.8884,2,1,23
38,B0002AQKKW,A1510 Pet House for Turtles and Newts,The Pet House Turtle Bowl is t...,amphibians and reptiles,amphibians and reptiles_4,0.3945230769230768,13,1,23
130,B0002H3XQE,Perla 7 Dog Bed - Green - 40.5 in. x 28 in.x 12.5 in.,The Perla Bed is an excellent ...,dog,dog_3,0.92755,6,1,23
15,B000256DW2,Two Little Fishies ATLPB2 Phosban 150gm,Synthetic ferric oxide hydroxi...,fish,fish_1,0.3150633333333334,60,1,23
4,B000084EZA,Petmate Wire Top Cabin Kennel (Small)- 17 x 12 x 8,Dosckocil Petmate - Cabin Kenn...,bird,bird_2,0.7669,1,1,23
5809,B00CGRNKRU,"Whole Life Pet Tail Mix Real Food Treats For Dogs-Grilled Chicken, 2.5Oz",Feel good knowing you are givi...,dog,dog_1,0.8394125,8,1,23
1086,B003MEX6XO,"Plaid:Craft Me and My Peeps Family Decals, 3-Inch by 4.25-Inch, Dad",PLAID-Me and My Peeps Family D...,other,other_6,0.7043,4,1,23
35,B00025YRJI,"Boyd Enterprises ABE16710 Freshwater Vitachem for Aquarium, 16-Ounce",Vitachem is a pre-stabilized m...,fish,fish_4,0.5487714285714287,28,1,23
251,B000SSCGME,Vet My Pet Grown in USA All Pets,<b>PRODUCT DETALS: </b><br><br...,cat,cat_6,0.9625,1,0,23
216,B0002ML6PY,Zeigler Koi Fancier (33-lb bag),The Zeigler Koi Fancier is a c...,fish,fish_5,0.0348,1,1,23
5454,B00OKX2EYS,Orphek Azurelite 5 Watt LED Flashlight,The Orphek Azurelite 5 Watt LE...,fish,fish_0,0.5415545454545453,11,1,23
16,B000255PJO,"Cichlid Lake Salt, 250 g / 8.8 oz",Sachem's Cichlid Lake Salt is ...,fish,fish_6,0.5296490909090908,55,1,23
29770,B00MMKXA1W,Agility Gear 1&quot; Molded Jump Cups - 10 Pack,These Jump Cups are molded wit...,dog,dog_0,0.54866,20,0,23
39,B0002APIWS,"Sun Seed Company Bss50020 Economical Mix Canary Food, 25-Pound",Sunseed economical mix canary ...,bird,bird_6,-0.125,2,1,23
10666,B009816GOQ,"Full Spectrum Hemp Oil for Dogs and Cats (250mg) - Grown &amp; Made in USA - Supports Hip &amp; Joint Health, Natural Relief for Pain, Separation Anxiety - Organic Extract - Non-GMO - Easily Apply to Treats",This utility brush is ideal fo...,other,other_0,0.5013636363636363,11,1,23
184,B0007P13HC,9Lives Prime Entree with Real Tuna and Shrimp (24/5.5-oz cans),9 Lives Prime Entree with Real...,cat,cat_3,0.9813,1,1,23
147,B0002AT0GS,8 in 1 Pet Products Cockatiel Ultrablend Moulting Food 7oz,Unique nutritional blend enric...,bird,bird_1,0.9336,1,0,23
3762,B00DQR961I,Avitech Herbal Bird Rx Arthritis Formula Pain Relief Bottle - 2oz.,Relief from pain due to arthri...,bird,bird_0,0.6951444444444445,9,0,23
635,B00285ZVNG,"Mighty Dog Variety Pack. Hearty Pulled-Style Chicken Dinner, Porterhouse Steak Flavor, Hearty Pulled-Style Beef Dinner 12 - 5.5 oz casn (Pack of 2, 24 cans total)(Green Box)",Disclaimer: While we aim to pr...,other,other_5,0.7168666666666667,3,1,23
2322,B003AVGMLC,"Mendota Products Dog Slip Lead, xs, Mocha",Hand Crafted in the USA - this...,dog,dog_2,0.7543666666666666,9,1,23
229,B0002E7JDU,New Life Spectrum Jumbo Fish Formula - 225 g,New Life Spectrum Jumbo Fish F...,fish,fish_3,0.8439,1,0,23
419,B000HHSJCM,Start to Finish Horse Snacks,MANNA PRO-MSC 38639 Peppermint...,farm animals,farm animals_0,0.6550083333333333,12,1,23
113,B0002ZAFVM,"Oster Blade Set A-5 - #5/8 Close Cutting 5/8"" - 1/32"", 14 mm Wide",The product type is Oster Blad...,other,other_1,0.4894333333333333,3,1,23
25,B0002DK5D2,GYM BAR (SAM-142 ONLY),"Virtually Indestructible, fun ...",rabbits and rodents,rabbits and rodents_2,-0.0545999999999999,2,1,23
45,B0002AQDKO,"Zoo Med Mesh Reptile Hammock, 17.5-Inch",A soft nylon mesh which provid...,amphibians and reptiles,amphibians and reptiles_2,0.487960416666667,624,1,23
38,B0002AQLME,API TROPICAL FISH CARE PACK Water Conditioner 1-Ounce Bottle 2-Pack,API TROPICAL FISH CARE PACK in...,fish,fish_2,0.3481777777777778,9,0,23
616,B0006JLPPO,"Imagine Gold Llc AIM71256 Bio 3 Cart Penguin 125, 6-Pack",A new design in filter cartrid...,rabbits and rodents,rabbits and rodents_4,0.7532333333333333,3,1,23
709,B001EH1R28, Ocean Clear Replacement Cartridge for 325 Filter [Misc.] ,Replacement cartridge for the ...,amphibians and reptiles,amphibians and reptiles_0,0.7535999999999999,7,1,23
80,B0002DGL1W,"Flourish Iron, 2 L / 67.6 fl. oz.",Flourish Iron is a highly conc...,rabbits and rodents,rabbits and rodents_1,0.5005499999999999,10,0,23
13090,B00LPN5P3I,"Soft Claws Nail Caps for Cats, Large Clear CLS (Cleat Lock System) Size 14+ lbs",Soft Claws Cat Nail Caps Take-...,cat,cat_0,0.4937666666666667,15,1,23
36,B0002AQWP0,MARCHIORO CAGE TOMMY 102 BEIGE,Small Animal Cage Marchioro by...,rabbits and rodents,rabbits and rodents_1,0.904325,4,1,24
554,B001L9XT02," Kenchii Five Star Offset Grooming Shear 8&quot; Straight"" />",Model: KEFSO Five Star Offset ...,other,other_1,0.8093,3,1,24
1533,B00DAMXXLS,TORRIX Cats Flea and Tick Collar &ndash; 8-Month Flea Prevention Cat Collar &ndash; Adjustable and Waterproof Cat Flea and Tick Control,",Torrix pet collar is an excel...",amphibians and reptiles,amphibians and reptiles_0,0.6749571428571429,7,0,24
1766,B004VETRNM,Mendota Pet Small Slip Solid Dog Lead,Discover the timeless design a...,dog,dog_4,0.8919666666666668,6,1,24
3611,B018BZHWO2,"Krudzapper Ointment, 16 oz",Krudzapper is a topical spray ...,farm animals,farm animals_0,0.401590909090909,11,0,24
55,B00028ZM7Q,"MARDOG No Bark Collar for Small, Medium, Large Dogs &ndash; Upgrade 2018 &ndash; Stop Barking Collar with Vibration and Sound &ndash; Humane and Safe for Dogs and 100% Waterproof Design",Your dog's barking has become ...,dog,dog_2,0.6988222222222222,9,0,24
313,B000ALGROC,Vetbasis Herbal Cat Litter,...,cat,cat_5,0.8559666666666667,3,0,24
1088,B003C8EUIA,"POP VIEW Dog Bark Collar for Small, Medium, Large Dogs, Anti Bark Collar with Sound and Vibration, No Shock, Harmless &amp; Humane",New version bark collar...,dog,dog_5,0.47995,6,1,24
770,B002CEMDDO,"Meyda Tiffany 14425 Fabric &amp; Fringe Tulip Lamp Shade, 11.5&quot; Width","Nearly two decades ago, Meyda ...",other,other_4,0.6440666666666667,3,0,24
135,B0002DGZ22,"Junglewood 2-Step Rope Ladder, Small, 6 Inches x 14 Inches",The Living World Junglewood 2-...,bird,bird_4,0.85,1,0,24
31,B00028ZM8A,Bemis (Evercare) Pet Hair Pic Up Refill 60 Ct,This 60-layer adhesive roller ...,cat,cat_4,0.52055,2,1,24
18282,B0169I2LIU,"STAR WARS C-3PO &amp; R2-D2 Mice Cat Toys, Pack of 2 toys",STAR WARS C-3PO & R2-D2 Mice C...,cat,cat_0,0.7231666666666666,15,1,24
4,B000255ORW,"Zoo Med Laboratories SZMZM30 Land Tortoise and Omnivore Food, 6-Ounce","At last, a natural long-stem f...",amphibians and reptiles,amphibians and reptiles_2,0.7039666666666666,3,1,24
73,B00029PO78,"Reef Salt, 189 L / 50 gal.",Seachem's Reef Salt is a chemi...,fish,fish_3,0.9286,1,0,24
22,B00025650C,Sunseed Vita Cockatiel - 6 lbs,",<b>Vitakraft Sunseed Vita Coc...",bird,bird_2,0.4404,1,1,24
141,B0002ASNI4,Sun Seed Company Cockatiel Honey Bell 3Pk (Card),Golden honey combined with Coc...,bird,bird_1,0.8519,1,1,24
200,B00061V0ZC,Vo-Toys Leather and Suede Baby Mice 2 pack Cat Toy,Made of leather and suede mate...,cat,cat_1,0.6723,4,1,24
705,B002B5FA1Q,CLAC Fly Repellent Deodorant-Roll-On - 75ml,Natural fly repellent in easy ...,other,other_2,0.8088000000000001,3,1,24
444,B000674Y90,"Laura Mercier Eye Brow Brush, Double Ended",Laura Mercier's Double Ended E...,cat,cat_2,0.5715600000000001,5,1,24
149,B0006NZH54,Flea Collar Pet Essential Oil Pest Control Collars Flea and Tick Prevention for Cats Dogs 8 Months Flea Control &amp; Cat Flea Treatment Kitten Collar with Natural Plant Extracts One Size Fits All,Our flea collar provides full ...,rabbits and rodents,rabbits and rodents_0,0.1326545454545455,11,0,24
226,B0002H3QFM,"General Cage Premium Folding 200 Series Pet Crate w metal pan, Side Door, 17&quot; W x 24.25&quot; D x 20.25&quot; H, White Epoxy Finish",The 200 series of premium fold...,rabbits and rodents,rabbits and rodents_3,0.8112,1,0,24
5,B000084EN5,TetraPond Floating Koi Sticks,TetraPond Koi Vibrance pond fi...,fish,fish_6,0.6011259923175427,781,1,24
60,B0002AQI9K,"Marina Airline Tubing, 20 Feet",The Elite airline tubing is th...,fish,fish_4,0.5445241134751772,141,1,24
677,B002L3C6U6,Personalized Custom Engraved Granite Pet Memorial by Eric @ StoneArtUSA / Marker Gravestone Garden Stone Monument Markers Memorials Laser Etched w/ Photo Dog Cat Horse Pets LGM,......Solid granite Pet Marker...,other,other_3,0.8018000000000001,3,1,24
350,B000ROQ3VO,Cosmic Pet 2 Tone Sponge Balls,Inexpensive cat toy that keeps...,cat,cat_3,0.9931,1,1,24
64,B00025YVTE,"USB Charger Multi device charging-iPhone,IPad,Samsung,Galaxy-USB Wall Charger 5 Port-Quick Charge 3.0 Port-Fast Charging Station",<b>?Why do you need anti-bark ...,bird,bird_3,0.6249,2,1,24
24,B0002567NM,"P Clear Particulate Water Clarifier, 4 oz.",...,cat,cat_6,0.9277,1,1,24
41,B0002AQMN2,"40w Power Glo Fluorescent Bulb T8, 48in",The Power-Glo Fluorescent Aqua...,fish,fish_1,0.4884368421052631,19,1,24
26019,B00K7HKBQO,"Blue Buffalo Chicken Bits Dog Treats,",Blue Buffalo Chicken Bits are ...,dog,dog_0,0.596595,20,1,24
0,B000255N14,API Pond Stress Coat Pond Water Conditioner Bottle,API POND STRESS COAT Pond Wate...,fish,fish_2,0.4987505917159759,338,1,24
79,B0002APUJY,Gk9500 Bowl Buddi Goldfsh Kt,Bowl Buddies Goldfish Care Kit...,fish,fish_5,0.9522,1,0,24
222,B0002ARPWO,"Bird Ladders 9 Step 14"""" x 4 1/4""""",Fun diversion and healthy exer...,rabbits and rodents,rabbits and rodents_4,0.5691333333333334,3,0,24
109,B0006L2VMS,Kaytee Clip-On Carrot Veggie Chews,Healthy playtimes chew toy for...,rabbits and rodents,rabbits and rodents_6,0.8370142857142857,7,1,24
9,B0002APJO0,"JurassiDiet - Bearded Dragon, 80 g / 2.8 oz.",JurassiDiet is THE premium foo...,amphibians and reptiles,amphibians and reptiles_4,0.144475,4,1,24
2473,B000GKF298,Digest Zymez,For meat eating pets only. The...,dog,dog_6,0.6747916666666667,12,1,24
37,B0006JLPQS,2 Pack Bio3 Cartridges For Emperor Filters - Part #: 72802,...,rabbits and rodents,rabbits and rodents_2,-0.66735,2,1,24
28,B0002565DO,"Intake Tube and Strainer for Magnum 200, 220, 330 and 350 Canister Filters",The replacement Intake Tube an...,fish,fish_6,0.5378058823529412,17,1,25
749,B000GKIHRC,"Naturfiber Holistic Animal Care,4 Oz",Azmira Holistic Animal Care's ...,cat,cat_2,0.51274,5,1,25
389,B000BJ45KQ,Purrforma Waste Box Bags : Size 12 PACKS OF 4 BAGS EACH,...,cat,cat_1,0.8177,4,1,25
26,B0002I73IW,"Sandia Pet Products 3/8"" REGULAR Brown Ferret Collar with Bell - Adjustable 6 to 8 Inches","Top quality, adjustable nylon ...",rabbits and rodents,rabbits and rodents_2,-0.5555,1,1,25
2280,B00494JZTK,Paradise Toys 3/4-Inch Cotton Bungie,"Call it what you like, a bungi...",bird,bird_0,0.7148888888888889,9,1,25
