,asin,title,description,category,topic_name,bubble_color,bubble_size,clean_link,topic_rank
14,B00009K77E,Jasper 500J Model 500 Router Circle Cutting Jig Base Plate Adaptor,Jasper base plate adapter converts your router base to use porter cable style guide bushings.,other,other_5,0.637,2,1.0,49
15,B00009K77E,Jasper 500J Model 500 Router Circle Cutting Jig Base Plate Adaptor,Jasper base plate adapter converts your router base to use porter cable style guide bushings.,other,other_5,0.637,2,1.0,50
22,B00019JVCI,MAM 3 Pack of 5 oz. bottles,,other,other_5,0.9157,2,1.0,28
23,B00019JVCI,MAM 3 Pack of 5 oz. bottles,,other,other_5,0.9157,2,1.0,29
27,B0001M9YCW,Fairy and Roses Birdfeeder - Style 32205,"Let this rosy fairy feed your feathered friends! Seated in the center of a flower, she is nicely det...",other,other_5,0.95615,2,1.0,43
28,B0001M9YCW,Fairy and Roses Birdfeeder - Style 32205,"Let this rosy fairy feed your feathered friends! Seated in the center of a flower, she is nicely det...",other,other_5,0.95615,2,1.0,44
45,B0002AQ1P6,Penn Plax 6344 Heater Holder Suction Cups (2 Pack),Allows precise monitoring of both the temperature and humidity of your terrarium from one unit. Temp...,other,other_5,0.6649,2,1.0,73
56,B0002AQWUA,PowerFlo Biological Add-on Filter Chamber,Add to any powerflo internal pond filter without media. Can be added to our item numbers:  041021 or...,other,other_5,0.79365,2,1.0,79
84,B0002AT8Y2,"Blue Ribbon Pet Products Exotic Environments Sea Horses Aquarium Ornament, Large","Adorable, colorful and whimsical. Perfect for smaller tanks and bowls, safe for all freshwater and s...",other,other_5,0.46685,2,1.0,87
137,B0002PXT7Y,"Charming Pet Halloween Corduroy Zonkers Pet Squeak Toy, Dog",These soft and sturdy Halloween characters are made from a durable corduroy and lined with Denier La...,other,other_5,0.3712,2,1.0,74
138,B0002PY2QG,"Charming Party Collar, Rainbow Rhinestone, X-Large",Your pet will be dressed to the nines for any special occasion in this Chiffon Ribbon Party Collar,other,other_5,0.65785,2,1.0,98
139,B0002PY2QG,"Charming Party Collar, Rainbow Rhinestone, X-Large",Your pet will be dressed to the nines for any special occasion in this Chiffon Ribbon Party Collar,other,other_5,0.65785,2,1.0,99
154,B000301ET8,"Hamilton Heavy Choke Chain Dog Collar, 20-Inch",Hamilton Heavy Choke Chain Dog Collar provides extra control over your dog while walking. This Dog c...,other,other_5,0.1709,2,1.0,41
155,B000301ET8,"Hamilton Heavy Choke Chain Dog Collar, 20-Inch",Hamilton Heavy Choke Chain Dog Collar provides extra control over your dog while walking. This Dog c...,other,other_5,0.1709,2,1.0,42
161,B00061V1P6,Vo-Toys Bamboo Finch Giant Nest 6x6in,"Vo-Toys Bamboo Finch Giant Nest 6x6in Giant oval shape bamboo nest makes birds feel warm, safe, and ...",other,other_5,0.7863500000000001,2,1.0,68
163,B00061W8EE,Sherpa Montreal Pet Tote - Red Faux Alligator / Standard,,other,other_5,0.9085,2,1.0,33
164,B00061W8EE,Sherpa Montreal Pet Tote - Red Faux Alligator / Standard,,other,other_5,0.9085,2,1.0,34
168,B00065IFPG,Chums 99194 Micro-fiber Lens Cleaning Cloth With Pouch &amp; Hook (Pack of 30),Sold as one unit. (1 unit = Pa/30 x 30.) Soft and durable micro- fiber lens cloth easily pulls out o...,other,other_5,0.5751,2,1.0,58
169,B00065IFPG,Chums 99194 Micro-fiber Lens Cleaning Cloth With Pouch &amp; Hook (Pack of 30),Sold as one unit. (1 unit = Pa/30 x 30.) Soft and durable micro- fiber lens cloth easily pulls out o...,other,other_5,0.5751,2,1.0,59
176,B0006JLMDE,LUNAR LIGHT BASE MODULE - MOON WHITE,"When the day is done, the Current USA Lunar Light begins its work. By casting a beautiful moon glow ...",other,other_5,0.3358,2,1.0,35
183,B0006JLXBU,"Flourish Trace, 2 L / 67.6 fl. oz.",Flourish Trace supplies a broad range of trace elements demonstrated to be necessary for proper paln...,other,other_5,0.8064333333333332,3,1.0,13
184,B0006L0UOE,Holt Dog Walking Collar Red Size 5,Holt walking collars are designed to easily and quickly control a dog. Stops the animal from pulling...,other,other_5,0.6801,3,1.0,11
197,B0006L7KEC,"Herm Sprenger Medium 2.5mm 20"" Choke Collar, One Size",Herm Sprenger strives to ensure that the K9 equipment that carries their logo meets or exceeds the h...,other,other_5,0.3551,3,1.0,25
201,B0006O7KGC,Robart Manufacturing Air Control Valve 2 position 5 port (Blue),",This is a 2-Way Air Control Valve for Most Pneumatic Retract Systems.<br /><br />FEATURES: Brass Ai...",other,other_5,-0.02015,2,1.0,62
202,B0006O7KGC,Robart Manufacturing Air Control Valve 2 position 5 port (Blue),",This is a 2-Way Air Control Valve for Most Pneumatic Retract Systems.<br /><br />FEATURES: Brass Ai...",other,other_5,-0.02015,2,1.0,63
215,B0009I572O,Racor PRS-R Racquet Sports Rack,PRS-R Features: -Sports rack.-Securely holds 4 or more racquets and balls.-Rubber coating protects r...,other,other_5,0.8162199999999998,5,0.0,4
219,B0009YSD4W,Petmate Purrforma Extra-Large Disposable Litter Box Liners,Petmate disposable litter pan liners for Purrforma Extra-Large are recommended to be replaced monthl...,other,other_5,0.1674999999999999,2,1.0,30
220,B0009YSD4W,Petmate Purrforma Extra-Large Disposable Litter Box Liners,Petmate disposable litter pan liners for Purrforma Extra-Large are recommended to be replaced monthl...,other,other_5,0.1674999999999999,2,1.0,31
234,B000BQSXZ2,"Hartz Natural Rawhide Retriever Braids, 10&quot;, 1 ea",Rawhide is an ideal treat for aggressive chewers. Chewing will naturally promote plaque and tartar r...,other,other_5,0.6797,2,1.0,45
235,B000BQSXZ2,"Hartz Natural Rawhide Retriever Braids, 10&quot;, 1 ea",Rawhide is an ideal treat for aggressive chewers. Chewing will naturally promote plaque and tartar r...,other,other_5,0.6797,2,1.0,46
249,B000EBP0D2,"Milk-Bone Bakery Bites Bacon Chips 'N Cheese Cookies For Dogs, 14-Ounce Bags (Pack Of 10)",Resealable! Cookies for dogs! Bone Shaped. Chock-full of chips. You love a little indulgence and so ...,other,other_5,0.2908,2,1.0,64
250,B000EBP0D2,"Milk-Bone Bakery Bites Bacon Chips 'N Cheese Cookies For Dogs, 14-Ounce Bags (Pack Of 10)",Resealable! Cookies for dogs! Bone Shaped. Chock-full of chips. You love a little indulgence and so ...,other,other_5,0.2908,2,1.0,65
287,B000IHAH94,Lfgd Aquastep 10W Uv Bulb,Replacement U.V. bulb for Lifegard Aquastep.,other,other_5,0.1457999999999999,3,1.0,17
297,B000KB0THI,"Stazko Pet Ear Cleaner, 8-Ounce","Protect pet ears with Stazko Ear Cleaner. This gentle cleaner works to soothe, clean and deodorize e...",other,other_5,0.7323,4,1.0,7
316,B000NQ106E,Murine Eye Drops For Allergy Eye Relief - 0.33 Oz 1 Ea,"Provides safe, effective relief from dry, itchy, watery eyes associated with allergies. Gentle enoug...",other,other_5,0.35985,2,1.0,47
317,B000NQ106E,Murine Eye Drops For Allergy Eye Relief - 0.33 Oz 1 Ea,"Provides safe, effective relief from dry, itchy, watery eyes associated with allergies. Gentle enoug...",other,other_5,0.35985,2,1.0,48
331,B000O5I4WC,"DISCONTINUED - Puppy Training Pads, SIZES: 30 PAD PACK",,other,other_5,0.76995,2,1.0,56
332,B000O5I4WC,"DISCONTINUED - Puppy Training Pads, SIZES: 30 PAD PACK",,other,other_5,0.76995,2,1.0,57
336,B000OUX00I,Enforcer Bugmax 365 Pest Control,Enforcer Bugmax 365 Pest Control Kills On Contact Odorless Non-staining Deltamethrin Formula Control...,other,other_5,-0.2447,2,0.0,27
347,B000S83IGM,Pnv Daily Best Dog Tabs 60ct,<b> Pet Naturals of Vermont Daily Best Multivitamin For Dogs and Puppies Chicken Liver <b>Descriptio...,other,other_5,0.92855,2,1.0,37
348,B000S83IGM,Pnv Daily Best Dog Tabs 60ct,<b> Pet Naturals of Vermont Daily Best Multivitamin For Dogs and Puppies Chicken Liver <b>Descriptio...,other,other_5,0.92855,2,1.0,38
359,B000UBEWSU,Ornaments To Remember Poncho Hand-Blown Glass Ornament,"When an evening on the Mexican coast turns cool, put on a Poncho and keep the fiesta going. The Ponc...",other,other_5,0.8199666666666667,3,1.0,15
360,B000UBEWSU,Ornaments To Remember Poncho Hand-Blown Glass Ornament,"When an evening on the Mexican coast turns cool, put on a Poncho and keep the fiesta going. The Ponc...",other,other_5,0.8199666666666667,3,1.0,16
364,B000UH4N6K,"Dusico Party Balloons 12 Inches Rainbow Set (100 Pack), Assorted Colored Balloons Bulk Made Strong Latex Helium Air Use, Birthday Balloon Arch Supplies, Decoration Accessory","Balloons Party Pack Helium 12 Inches Rainbow Set, Assorted Colored Balloons Made With Strong Latex F...",other,other_5,0.63575,2,0.0,88
365,B000UH4N6K,"Dusico Party Balloons 12 Inches Rainbow Set (100 Pack), Assorted Colored Balloons Bulk Made Strong Latex Helium Air Use, Birthday Balloon Arch Supplies, Decoration Accessory","Balloons Party Pack Helium 12 Inches Rainbow Set, Assorted Colored Balloons Made With Strong Latex F...",other,other_5,0.63575,2,0.0,89
368,B000UJXFAI,"Fashion Pet Outdoor Dog Plaid Fleece Jacket, X-Small, Pink","This Reversible printed plaid polar fleece coat is solid on reverse side, contrast solid binding aro...",other,other_5,0.58315,2,1.0,80
369,B000UJXFAI,"Fashion Pet Outdoor Dog Plaid Fleece Jacket, X-Small, Pink","This Reversible printed plaid polar fleece coat is solid on reverse side, contrast solid binding aro...",other,other_5,0.58315,2,1.0,81
399,B000Y901ME,"Zanies Holiday Toys Display Refill, 80-Pack",Use this selection of 80 best-selling Zanies holiday toys to restock your Zanies holiday toy display...,other,other_5,0.6032,2,1.0,96
400,B000Y901ME,"Zanies Holiday Toys Display Refill, 80-Pack",Use this selection of 80 best-selling Zanies holiday toys to restock your Zanies holiday toy display...,other,other_5,0.6032,2,1.0,97
410,B000YJ0LG0,Aqua Ultraviolet A50007 Ultima II 6000 with 2&quot; Valve,"To support aquatic life whether at an aquaculture facility, backyard pond or large aquarium system i...",other,other_5,0.41355,2,1.0,60
420,B00129M4P2,"Buddy&amp;Max Probiotic Chews for Dogs - Digestive Enzymes - Diarrhea, Stomach, Vomit, Gas, Weight Support, Allergy Relief - Contains Prebiotics - Dog Probiotics Supplement - 130 Chews",<b>PRODUCT DETAILS:</b><br> - All natural organic ingredients<br> - Made in the USA<br> - Improves d...,other,other_5,0.60885,2,1.0,69
421,B00129M4P2,"Buddy&amp;Max Probiotic Chews for Dogs - Digestive Enzymes - Diarrhea, Stomach, Vomit, Gas, Weight Support, Allergy Relief - Contains Prebiotics - Dog Probiotics Supplement - 130 Chews",<b>PRODUCT DETAILS:</b><br> - All natural organic ingredients<br> - Made in the USA<br> - Improves d...,other,other_5,0.60885,2,1.0,70
428,B0012X6FK8,"Buddy&amp;Max Probiotic Chews for Dogs - Digestive Enzymes - Diarrhea, Stomach, Vomit, Gas, Weight Support, Allergy Relief - Contains Prebiotics - Dog Probiotics Supplement - 130 Chews",<b>PRODUCT DETAILS:</b><br> - All natural organic ingredients<br> - Made in the USA<br> - Improves d...,other,other_5,0.9397,3,1.0,10
432,B0013KGFAK,"Meyda Tiffany 14425 Fabric &amp; Fringe Tulip Lamp Shade, 11.5&quot; Width","Nearly two decades ago, Meyda Tiffany acquired quality bent glass Company which created original lig...",other,other_5,0.5398999999999999,3,1.0,14
439,B0015QX294," Petlabs360 Shed No More For Cats, 90-Count Bottle",HARMLESS SOUND AND VIBRATION - dog bark collar effective and easy to use. It uses progressively incr...,other,other_5,0.17805,2,1.0,75
441,B0016BOCEW,"Spectrum Essentials Cod Liver Oil, 520 mg SoftGels, 200 Count Bottle","At Spectrum, we work with talented, dedicated people to create the best products possible, and using...",other,other_5,0.60675,2,1.0,39
442,B0016BOCEW,"Spectrum Essentials Cod Liver Oil, 520 mg SoftGels, 200 Count Bottle","At Spectrum, we work with talented, dedicated people to create the best products possible, and using...",other,other_5,0.60675,2,1.0,40
446,B0016KXG18,"12&quot; Latex Happy Anniversary Balloons, 6ct",Give your sweet celebration of love a colorful lift with our Latex Happy Anniversary Balloons. These...,other,other_5,0.6927,3,1.0,19
462,B0017JG408,Laguna Impeller Cover for PowerJet 7000/2150 Skimmer Filter Pump,"This impeller cover is used for Laguna PowerJet skimmer filter pump models 7000, 2150. Skin packed o...",other,other_5,0.3592,2,1.0,84
471,B00186VRIY,"Buddy&amp;Max Probiotic Chews for Dogs - Digestive Enzymes - Diarrhea, Stomach, Vomit, Gas, Weight Support, Allergy Relief - Contains Prebiotics - Dog Probiotics Supplement - 130 Chews",<b>PRODUCT DETAILS:</b><br> - All natural organic ingredients<br> - Made in the USA<br> - Improves d...,other,other_5,0.8157,2,1.0,66
472,B00186VRIY,"Buddy&amp;Max Probiotic Chews for Dogs - Digestive Enzymes - Diarrhea, Stomach, Vomit, Gas, Weight Support, Allergy Relief - Contains Prebiotics - Dog Probiotics Supplement - 130 Chews",<b>PRODUCT DETAILS:</b><br> - All natural organic ingredients<br> - Made in the USA<br> - Improves d...,other,other_5,0.8157,2,1.0,67
480,B0018CJKJG,"The Rawhide Express Natural Knotted Bone Dog Chew, 15 By 16-Inch","The Rawhide Express dog chews in all shapes, sizes and flavors are a long lasting chew that make a g...",other,other_5,0.45835,2,1.0,36
498,B001BF5OVI,"Carolina Have, A, Hank Paisley Bandannas, 22-Inch by 22-Inch, Hot Pink","Each bandanna is a wearable 22"" x 22"" and made of 100% cotton. Bandannas are available in a vast var...",other,other_5,0.6788000000000001,2,1.0,91
501,B001CCNBG0,JW Pet Insight Sand Perch Swing For Birds Small -- 1 Toy,Your pet bird will enjoy swinging on this Sand Perch Swing by JW Pet Company. In addition to providi...,other,other_5,0.6466000000000001,2,1.0,93
502,B001CCNBG0,JW Pet Insight Sand Perch Swing For Birds Small -- 1 Toy,Your pet bird will enjoy swinging on this Sand Perch Swing by JW Pet Company. In addition to providi...,other,other_5,0.6466000000000001,2,1.0,94
515,B001DIKUBM, Brightwell Aquatics Calcion-P Dry Calcium Supplement for Reef Aquaria 200g / 7.1oz ,&#149; High&#045;purity powdered calcium&#046;&#149; Increases the concentration of calcium in marin...,other,other_5,0.5553,4,1.0,9
523,B001EHCDJY," ELZU.US 43396-266133 The Best Industries Bark Collar Upgraded Microprocessor Barking Detection Best No Bark Device with 3 Extra Batteries Beep, Black ",,other,other_5,0.806,2,0.0,26
536,B001F0GXKA, Seachem Reef Strontium 500ml ,Reef Strontium is intended to restore and maintain strontium to levels found in natural seawater wit...,other,other_5,0.5102142857142857,7,1.0,1
539,B001F93XA4,ML SIPHON KLEEN XL 24&quot;,Marineland/Aquaria Siphon Kleen is 6 feet of hose that helps to remove accumulated waste in your fis...,other,other_5,0.6826,2,1.0,54
544,B001FDRFMW,Bumble BEE Pet CostumeMedium by masterpet,"13""- 16"" Medium Pet

Cocker Spaniel; Scottish Terrier; Bichon Frise; Beagle; Corgi",other,other_5,0.4641,2,1.0,77
545,B001FDRFMW,Bumble BEE Pet CostumeMedium by masterpet,"13""- 16"" Medium Pet

Cocker Spaniel; Scottish Terrier; Bichon Frise; Beagle; Corgi",other,other_5,0.4641,2,1.0,78
553,B001HGETEO,"Buddy&amp;Max Probiotic Chews for Dogs - Digestive Enzymes - Diarrhea, Stomach, Vomit, Gas, Weight Support, Allergy Relief - Contains Prebiotics - Dog Probiotics Supplement - 130 Chews",<b>PRODUCT DETAILS:</b><br> - All natural organic ingredients<br> - Made in the USA<br> - Improves d...,other,other_5,0.5178666666666666,3,1.0,20
554,B001HGETEO,"Buddy&amp;Max Probiotic Chews for Dogs - Digestive Enzymes - Diarrhea, Stomach, Vomit, Gas, Weight Support, Allergy Relief - Contains Prebiotics - Dog Probiotics Supplement - 130 Chews",<b>PRODUCT DETAILS:</b><br> - All natural organic ingredients<br> - Made in the USA<br> - Improves d...,other,other_5,0.5178666666666666,3,1.0,21
559,B001I2UGVC,"ALL 3 Wonder Pets Pet Cape Linny Tuck Ming Ming GREEN, RED, and BLUE Cape","This auction is for ALL THREE CAPES. The capes measures 28"" long and 18"" across and fit most childre...",other,other_5,0.216,2,1.0,53
569,B001K5DNLC,Dog Coat - Blue Fleece Reflective Safety Jacket for Dogs - Small,Nothing is better for keeping pets warm and in sight during cold weather walks. Our Reflective Jacke...,other,other_5,0.7936,2,1.0,92
572,B001L1R7I0,Microbe-Lift Clarifier Plus for Freshwater Tanks,Clarifier Plus for Freshwater Tanks clears cloudy and hazy water quickly.,other,other_5,0.3111,2,1.0,90
578,B001LUH7K4,Tetra 25993 Whisper 20 Bio Foam Grid Replacement Kit for Aquarium Filter,Tetra whisper bio foam grid replacement kit. Bio foam provides an extreme amount of surface area for...,other,other_5,-0.1738499999999999,2,1.0,72
583,B001MXII26,"Aquatic Life Cartridge Pre-Filter for Aquarium, 1-Micron",The Aquatic Life premium quality micron cartridge fits all standard size RO/DI systems for proper fi...,other,other_5,0.4756,4,1.0,8
584,B001MXLW2E,"CPR Replacement Collection Cup Assembly For BakPak, Dual BakPak &amp; AquaFuge PS Refugiums","Replacement collection cup for CPR Aquatic's Bak Pak protein skimmers, AquaFuge PS refugiums, and Ae...",other,other_5,0.5970500000000001,2,1.0,95
590,B001OE6NWA," OmniPet Stainless Steel Coop Cup with Hook Mount, 10 oz ",These long-lasting stainless steel serving pieces feature a sparkling easy-to-clean finish. They are...,other,other_5,0.7847500000000001,2,1.0,82
591,B001OE6NWA," OmniPet Stainless Steel Coop Cup with Hook Mount, 10 oz ",These long-lasting stainless steel serving pieces feature a sparkling easy-to-clean finish. They are...,other,other_5,0.7847500000000001,2,1.0,83
607,B001U6TZEU,METEORLIGHT BALL DISCO,,other,other_5,0.86855,2,1.0,32
616,B001VPA8DM,"Top Performance Pawprint Satin Ribbon, 25 Yards, White/Red","This colorful satin acetate Top Performance Grooming Ribbon features no-fray edges, so you can creat...",other,other_5,0.5386500000000001,2,1.0,86
625,B001VPCBAA,"Geib 8-1/2-Inch Stainless-Steel Pet Gator Straight Shear, Small",Shears are precision weighted and balanced. Handles and finger rests are contoured for maximum comfo...,other,other_5,0.509,3,1.0,18
628,B00251NKTU,"IMAX 47126-2 Byzantine Dome Bird Cages, Set of 2","Byzantine Dome Bird Cages, Set of Two--This gorgeous, decorative set of gilded cages makes a stunnin...",other,other_5,0.6294500000000001,2,1.0,76
635,B00285ZVNG,"Mighty Dog Variety Pack. Hearty Pulled-Style Chicken Dinner, Porterhouse Steak Flavor, Hearty Pulled-Style Beef Dinner 12 - 5.5 oz casn (Pack of 2, 24 cans total)(Green Box)","Disclaimer: While we aim to provide accurate product information, it is provided by manufacturers, s...",other,other_5,0.7168666666666667,3,1.0,23
636,B00285ZVNG,"Mighty Dog Variety Pack. Hearty Pulled-Style Chicken Dinner, Porterhouse Steak Flavor, Hearty Pulled-Style Beef Dinner 12 - 5.5 oz casn (Pack of 2, 24 cans total)(Green Box)","Disclaimer: While we aim to provide accurate product information, it is provided by manufacturers, s...",other,other_5,0.7168666666666667,3,1.0,24
639,B002889FJO,Kotobuki Roka Dome S - BIO SPONGE FILTER for nano tank aquarium (ideal for shrimp &amp; fish fry) air-pump operated,,other,other_5,0.78315,2,1.0,51
640,B0028BKPMM,Canis Gear 17&quot; Black Basic Style Grooming Restraint,"The classic basic style grooming loop - great for beginners, a staple for experienced groomers. This...",other,other_5,0.8669,2,1.0,52
651,B002DZE7UE,Wave-Point Reef Wave 24-Watt High Output T-5 Lamp,High quality versatile high output T-5 lamp which can be a universal replacement lamp for industry s...,other,other_5,0.6403,2,1.0,100
682,B0035H9GNW,"Dogit Style Small Adjustable Nylon Collar with Plastic Snap, Inked, Blue on Blue",The Dogit Style Nylon Ribbon Collars are stylish and strong. Dogit Style Walking Apparel offers coll...,other,other_5,0.7618,2,1.0,71
703,B003GVTD3A,"Kinetic Joint III Select, 90 Capsules","Joint Select III is an oral supplement for people containing Glucosamine, Chondroitin and Hyaluronic...",other,other_5,0.28495,2,1.0,61
709,B003L2Q5YE,A4 Men's Cooling Performance Crew Short Sleeve Tee,A4 cooling performance crew short sleeve T-Shirt is made with an ultra tight knit polyester interloc...,other,other_5,0.7122333333333334,6,1.0,2
710,B003L2Q5YE,A4 Men's Cooling Performance Crew Short Sleeve Tee,A4 cooling performance crew short sleeve T-Shirt is made with an ultra tight knit polyester interloc...,other,other_5,0.7122333333333334,6,1.0,3
722,B003NIEIYA,Softflex Gripper Ball Medium,,other,other_5,0.8982666666666668,3,1.0,12
723,B003NTVSZG,12 Tiki Hut Surf Shack Beach Monkey Treat Boxes,,other,other_5,0.7161,2,1.0,85
724,B003OBY4S6,"Ne'Qwa Ornament Cardinals, 3-Inches Tall, Bell Design, Designed by noted artist Susan Winget",Ne'Qwa Art is the largest producer of the centuries-old tradition of painting on the inside of glass...,other,other_5,0.8239000000000001,2,1.0,55
0,B00004TVUM,Beltronics 890 Radar Detector,"Featuring a safety warning system and digital voice messages, Beltronic's 890 Radar Detector will sa...",rabbits and rodents,rabbits and rodents_1,0.5445463636363636,110,1.0,36
1,B00004TVUM,Beltronics 890 Radar Detector,"Featuring a safety warning system and digital voice messages, Beltronic's 890 Radar Detector will sa...",rabbits and rodents,rabbits and rodents_1,0.5445463636363636,110,1.0,37
4,B00004YYEL,"Diamond Farrier FT15 15"" Farrier Tong",FT15 Features: -Manufactured from special low carbon steel for lasting strength. -Will not become br...,rabbits and rodents,rabbits and rodents_1,0.5486529411764706,17,1.0,33
5,B00008DFPF,Oxbow Western Timothy Hay,Western Timothy is the most widely recommended grass hay. It provides a long-strand fiber source tha...,rabbits and rodents,rabbits and rodents_1,0.504725,4,1.0,47
6,B000255NNM,Blue Ribbon Pet Products - Airstone,"Blue ribbon pet products are manufacturers and importers of fish food, aquarium accessories and supp...",rabbits and rodents,rabbits and rodents_1,0.488488888888889,9,1.0,56
7,B000255NZ0,Python Algae Mitt Cloth for Aquarium,"This white, mitt-shaped algae remover effortlessly wipes away unsightly algae from glass and acrylic...",rabbits and rodents,rabbits and rodents_1,0.5800081081081082,37,1.0,28
8,B0002565YS,Kaytee Pine Bedding for Pet Cages,Kaytee Natural Pine Bedding and Litter is manufactured with all natural pine shavings specially proc...,rabbits and rodents,rabbits and rodents_1,0.4243283783783785,74,1.0,48
9,B0002565YS,Kaytee Pine Bedding for Pet Cages,Kaytee Natural Pine Bedding and Litter is manufactured with all natural pine shavings specially proc...,rabbits and rodents,rabbits and rodents_1,0.4243283783783785,74,1.0,49
12,B0002568O0,"Coralife 05476 Square Pin Compact Fluorescent Lamp, 96-Watt, 10K",CoraLifes 10K Compact Fluorescent Lamps have high output in a small package. The 10K Lamps are made ...,rabbits and rodents,rabbits and rodents_1,0.4593166666666666,6,1.0,92
13,B0002567B4,Brand New Marineland Max-Jet 1200 Item #7280,Ideal for creating internal water movement or powering under gravel filters.  Ingredients: Compact D...,rabbits and rodents,rabbits and rodents_1,0.583204,25,1.0,41
14,B0002568WC,"Kaytee Mixed Berry Flavor Yogurt Chips For Rabbit And Guinea Pig, 3.5-Oz Bag","Kaytee Yogurt Chips are delicious, fortified fruit flavored yogurt treats your pet will crave. Provi...",rabbits and rodents,rabbits and rodents_1,0.4235999999999998,187,1.0,57
15,B0002568WC,"Kaytee Mixed Berry Flavor Yogurt Chips For Rabbit And Guinea Pig, 3.5-Oz Bag","Kaytee Yogurt Chips are delicious, fortified fruit flavored yogurt treats your pet will crave. Provi...",rabbits and rodents,rabbits and rodents_1,0.4235999999999998,187,1.0,58
18,B000256ENK,Rio Plus 2100 Aqua Pump 692 GPH,The new and improved rio plus aqua pumps and power heads provide versatile water pump system designe...,rabbits and rodents,rabbits and rodents_1,0.5313057971014493,69,1.0,30
19,B00025YUZY,Caribsea Super Naturals Aquarium Sand,Create a supernatural experience by re-creating the natural world in your home. Enjoy a piece of the...,rabbits and rodents,rabbits and rodents_1,0.5895309090909087,110,1.0,44
20,B0002602T6,Vortex XL Diatom Filter - 8 in. x 15 in.,The Vortex Diatom Filter Model XL  is a high-speed mechanical filter that is designed to fine filter...,rabbits and rodents,rabbits and rodents_1,0.3125435897435897,39,1.0,93
21,B00026Z4JE,"pH Low Range 6.0-7.6 for Freshwater, 225-Tests",The Nutrafin pH Low Range Freshwater Aquarium Test Kit offers a full complement of test equipment: t...,rabbits and rodents,rabbits and rodents_1,0.677375,4,1.0,0
23,B0002A6VF6,YML Small Indoor Animal Cage w Stand,1 Pull Down Front Door And 1 On The Top of Cage. 2 Platforms and Ladders. 0.5 in. Bar Spacing To Pro...,rabbits and rodents,rabbits and rodents_1,0.93275,2,1.0,5
24,B0002A6VF6,YML Small Indoor Animal Cage w Stand,1 Pull Down Front Door And 1 On The Top of Cage. 2 Platforms and Ladders. 0.5 in. Bar Spacing To Pro...,rabbits and rodents,rabbits and rodents_1,0.93275,2,1.0,6
27,B0002APIX2,Four Paws Pet Products Ez Lock Screen Cover 30 Inch,Four Paws Safety Screen Covers are available in a variety of sizes and styles to meet the needs of a...,rabbits and rodents,rabbits and rodents_1,0.5940090909090907,110,1.0,22
28,B0002APU62,"Lee's Aquarium Discard-A-Stone Plastic Air Diffusers, Coarse Bubble",Keep a supply of fresh bubbles in your aquarium around the clock with a set of 6 discard-a-stones. U...,rabbits and rodents,rabbits and rodents_1,0.2510458333333333,24,1.0,29
29,B0002APX0U,"Lee's Triple-Flow Corner Filter, Large","Lee's Triple Flow Corner Filters may be used for biological, chemical or mechanical filtration, depe...",rabbits and rodents,rabbits and rodents_1,0.4770541666666666,48,1.0,50
32,B0002APZMQ,aqua heater - HT HEATR-12 200W,"aqua heater by Penn PLAX - Get Fast Shipping and Low Prices at PetsWarehouse.com on over 43,000 Pet ...",rabbits and rodents,rabbits and rodents_1,0.9381,1,0.0,14
33,B0002AQI5Y,"Marina Algae Magnet Cleaner, Large",The Marina Algae Magnet Cleaner enables you to clean the inside of the aquarium's glass without gett...,rabbits and rodents,rabbits and rodents_1,0.1661714285714286,14,1.0,89
