,asin,title,description,category,topic_name,bubble_color,bubble_size,clean_link,topic_rank
47,B0002AQDE0,Penn Plax Cockatiel Bird Swing,The cockatiel swing measures 7...,bird,bird_4,0.5329400000000001,15,1,73
308,B0006G58SC,Perfecto Fluorescent Aquarium Hood Black 48in,Perfecto Full Hood Black Fluor...,rabbits and rodents,rabbits and rodents_3,0.858,2,1,73
499,B001D7T3CA,"Buddy&amp;Max Probiotic Chews for Dogs - Digestive Enzymes - Diarrhea, Stomach, Vomit, Gas, Weight Support, Allergy Relief - Contains Prebiotics - Dog Probiotics Supplement - 130 Chews",<b>PRODUCT DETAILS:</b><br> - ...,other,other_1,0.6887,2,1,73
1235,B000XB8R4M,Annamaet 25% Encore Dog Food - 40 lb,"An ""encore"" of our original fo...",dog,dog_2,0.7864285714285716,7,1,73
26,B0002564O4,Penn Plax Lok Tite Plastic Gang Valve Aquarium Pump Accessories,Lok-Tite Air Control Valves al...,fish,fish_6,0.4078070422535211,71,1,73
314,B0006JLP36,Impeller Assembly for the Laguna Skimmer Filter Pump (2905 gph),The Laguna Impeller Assembly i...,fish,fish_0,0.551675,8,1,73
587,B00167XQI4,"Zoo Med Naturalistic Flora Birdsnest Fern, 12-Inch",Naturalistic FloraTM Birds Nes...,amphibians and reptiles,amphibians and reptiles_0,0.7171199999999999,5,0,73
219,B0002DI56Q,Lafeber's Premium Daily Diet Pellets for Finches,Dr. Lafeber Sr. created the ve...,bird,bird_6,0.7370454545454543,11,1,73
45,B0002AQ1P6,Penn Plax 6344 Heater Holder Suction Cups (2 Pack),Allows precise monitoring of b...,other,other_5,0.6649,2,1,73
281,B000EUEF8Y,Artemis Fresh Mix - Weight Management - 15 lb,Artemis Fresh Mix Weight Manag...,other,other_6,0.7092,2,1,73
38,B00025Z6VG,Tetramin Pro Fish Food,TetraMin PRO offers advanced n...,fish,fish_4,0.6563166666666667,6,1,73
402,B000Y91G8W,"Zanies 2-Inch Fur Balls Cat Toys Canister, 60-Pack",Zanies canister cat toy canist...,cat,cat_3,0.7465,3,1,73
1575,B0043OX3XK,Milk-Bone Essentials Plus Optimal Health Dog Biscuits - Small,Milk-Bone Essentials Plus Oral...,dog,dog_4,0.796875,4,1,73
10776,B00FW7W80G,"Chris Christensen #013 Cat/Carding All Fine Dual Tooth Pet Comb, 6&quot;","Cat/Carding Buttercomb 6"" All ...",cat,cat_0,0.6710363636363637,11,1,73
12,B0002563RM,"A16930 AquaClear Impeller Assembly, 70 Powerhead",The AquaClear Impeller Assembl...,rabbits and rodents,rabbits and rodents_5,0.30380625,16,1,73
220,B0002DJRIQ,Tetra 25875 Whisper C Impeller for Aquarium Filter Replacement Part,Tetra whisper c impeller. Repl...,fish,fish_3,0.4636999999999999,10,0,73
1255,B004HQTF04,Dianes K9 Creations Inc. Handmade Large Raised Orthopedic Dog Cot. 38x50x10 Caribbean Blue Canvas. Dogs up to 130 Pounds,"38"" x 50"" x 10"" high. Caribbea...",dog,dog_5,0.8804000000000001,4,1,73
11,B0002563K4,AquaClear Extension Tube for Power Filters,The AquaClear Extension Tube i...,fish,fish_5,0.3961537414965985,147,1,74
83,B0002AQDXQ,Vitakraft Fresh Super Fruit Cocktail Parrots Cockatiels,Treat your Cockatiel or Parrot...,bird,bird_1,0.562201724137931,58,1,74
137,B0002PXT7Y,"Charming Pet Halloween Corduroy Zonkers Pet Squeak Toy, Dog",These soft and sturdy Hallowee...,other,other_5,0.3712,2,1,74
829,B000USKMX2,Evercare Pet Hair Roller Adhesive Refill,PET HAIR PICKUP REFILL...,cat,cat_1,0.77395,2,1,74
6680,B00L2K94CC,"Aquatic Arts Ultimate Algae Cleaning Crew for 30 to 55 Gallon Aquarium - 3 Different Types of Snails! (Zebra Nerite Snails, Mystery Snails, and Black Devil Snails)",",This is the perfect combo pac...",rabbits and rodents,rabbits and rodents_0,0.7974375,8,1,74
25,B0002567YQ,"Fluval Suction Cups, (4) 4x12 mm and clips, (8) 4x14 mm (03, 04 and 05 Series)",The Fluval Suction Cups and Cl...,cat,cat_6,0.3378,43,1,74
188,B0009YSAVS,"PetSafe Staywell Add-a-Cat Extra Infrared Key Collar, Yellow",Key Yellow for IR Cat Door 500...,cat,cat_3,0.4763666666666666,3,1,74
3834,B00CCFXM8I,1/2 lb. Ken's Premium Brine Shrimp Flake,Our Premium Brine Shrimp Flake...,fish,fish_0,0.6846500000000001,8,0,74
52,B00025YU5Y,Penn Plax QCF1 Replacement Cartridge For Clear Free Filter (2 Pack),Clear-free disposable cartridg...,fish,fish_3,0.5393399999999999,5,1,74
562,B00061V278,Vo-Toys Hamster Slumber Den,Vo-Toys Hamster Slumber Den Ma...,rabbits and rodents,rabbits and rodents_4,0.9654,1,0,74
2173,B001PFAIU6,"&quot;If Tears Could Build a Stairway&quot; Pet Loss Sympathy Picture Frame Gift and Memorial , with optional custom photo editing",It's hard to know what to say ...,cat,cat_0,0.5890727272727272,11,1,74
44843,B0129U949Q,"Bark Collar [2018 Smart Chip] Dog Shock Anti-Barking Collar with Beep, Vibration and Harmless Shock. No Bark Control for Small/Medium/Large Dogs with 7 Sensitivity Levels, Rechargeable and Rainproo",Perfect for dogs of different ...,dog,dog_0,0.7943428571428571,14,1,74
83,B0002APNAU,"Ocean Star International AOSI0115 Osi Brine Shrimp Eggs Pet Food, 3.5-Ounce","Small, convenient filter fits ...",fish,fish_6,0.43484,10,1,74
195,B00063KN2Q,Mc Flea &amp; Tick Shampoo 12 Ounce Package - Part #: 10620,This product has been speciall...,other,other_3,0.8613,2,0,74
1333,B003TA2O9S,Wahl Chromado Professional Cord/Cordless Pet Clipper Kit,Wahl Chromado Professional Cor...,dog,dog_3,0.708575,4,0,74
2903,B00MW6TGXW,12 x 12 Engraved Black Granite Memorial Upgrade,...,farm animals,farm animals_0,0.8682714285714287,7,0,74
67,B0002AS9OM,Kaytee Gravity Bin Feeder with Bracket,Gravity Bin feeders hold up to...,rabbits and rodents,rabbits and rodents_5,0.390383732057416,209,1,74
5149,B016BSA5GI,Bonka Bird Toys 1003 Cliff Leather Bird Toy Parrot cage Toys Cages Cockatiel Conure Amazon Quality Product Hand Made in The USA,1003 Cliff leather is a cascad...,bird,bird_0,0.7809333333333335,6,1,74
1734,B0014LW7QE,Pet Waste Bags Three Rolls,This leak-proof plastic replac...,dog,dog_1,0.7507,6,1,74
87,B0002AQ8LS,Prevue Hendryx Cal Sea Yums Dollar Bird Toy,Prevue pet products cal-sea-yu...,bird,bird_3,0.652511111111111,18,1,74
11410,B008CN6IHQ,"PEROZEK Greenbone Biobase Training Pads, 30-Pack",Greenbone Biobase Pet Training...,dog,dog_6,0.8820000000000001,8,1,74
1,B000256CIC,"Fluval 2 Plus Foam Insert, 4-Pack",The Fluval 2 Plus Foam Pad has...,amphibians and reptiles,amphibians and reptiles_0,0.64894,5,1,74
27,B00028HN82,"Dr. Harvey'S Whisker Smackers Freeze Dried Single Ingredient Treats For Cats, Beef, 1-Ounce Bag",Whisker Smackers are a single ...,cat,cat_4,0.59588,10,1,74
309,B0006G5M38,Pretty Bird International Iguana Adult Diet - Large Pellet 4Lb,"Adult Iguana has 12% protein, ...",rabbits and rodents,rabbits and rodents_3,0.4837,2,1,74
16,B0002565KC,"PENN PLAX World Aquarium Filter, Small",Small World Aquarium Filters a...,fish,fish_4,0.4845113475177304,141,1,74
954,B000NRYX94,FOUR FLAGS MUZZLE PUG NOSE - SMALL,FOUR FLAGS MUZZLE MUZZLE PUG N...,cat,cat_2,0.4226,3,1,74
91,B0002E7JIK,New Life Spectrum Thera-A Jumbo 6Mm Sinking Salt/Freshwater Pet Food,New life spectrum Thera a jumb...,fish,fish_4,0.4621307692307693,13,1,75
4947,B00941HBB2,"Anit Accessories Enchanted Snow Princess Dog Costume, Medium, 16-Inch",Two piece enchanted snow princ...,dog,dog_2,0.8625571428571428,7,0,75
745,B001A5J028,Puppia Dog Mesh Harness &quot;Vest Soft&quot; Size:XLarge Color:Blue,The Puppia Soft Dog Harness is...,dog,dog_4,0.7694,4,1,75
963,B00294SMNC,Poop N' Go 8 pack (120 bags) Scented Pet Black Waste Bags Refill Rolls - Bags on Board type,Be a responsible pet owner and...,dog,dog_5,0.8928,4,1,75
54,B0002AQLVK,PondCare Nitrite Test Kit (180 Tests),Accurately determines the leve...,other,other_6,0.245,2,1,75
439,B0015QX294," Petlabs360 Shed No More For Cats, 90-Count Bottle",HARMLESS SOUND AND VIBRATION -...,other,other_5,0.17805,2,1,75
21,B000255O6S,Perfect-A-Flo Air Stone - 6 pk - 2 in. x 3/8 in.,Replacement air stones for Per...,other,other_4,0.82685,2,1,75
2,9828377357,Birds LOVE Go-Round Bird Toy,Graham's Parrot Toy Creations ...,bird,bird_4,0.4872440000000001,25,1,75
46,B0002AQ1HO,"Lee's Bird Net, Frame 9-3/4-Inch Diameter",Lee's Bird Nets have plastic h...,bird,bird_2,0.3035095238095238,21,1,75
22648,B00KVMS6YY,"4Moms Breeze Playard, Grey",Playards are hard to use. The ...,other,other_0,0.576725,8,1,75
112,B0002AQA7U,"Zoo Med Ultra Sun Trichromatic Super Daylight 6500K Fluorescent Bulb T8 14 Watt, 15-Inch",The Ultra Sun is a 6500K high ...,fish,fish_6,0.70016,5,1,75
105,B0002DHT4U,"Marina Aquarium Showcase Bulb, 15-Watt, 120-Volt, Green",Marina incandescent aquarium l...,other,other_3,0.56725,2,1,75
246,B0002AS758,Kaytee Crispy Loofah Chews 3pk,""",For chinchillas, ferrets, gu...",rabbits and rodents,rabbits and rodents_4,0.9262,1,1,75
74,B0002AQLMY,"ZuPreem Natural Large Bird Food, 3-Pound","Your Macaws, Cockatoos, Amazon...",bird,bird_6,0.585296551724138,116,1,75
7079,B005DL8MGA,PupPeroni Chicken Flavor Dog Treat 25 oz,Pup-peroni oven roasted chicke...,dog,dog_0,0.7075571428571429,14,0,75
626,B000WFMCK4,Precise Plus Cat Adult Food 16.5lb,Precise Plus Feline Adult Form...,cat,cat_5,0.9943,1,0,75
185,B0006JLMSO,Eheim AEH2080380 Professional 3-Filter for Aquarium,With EHEIM professionel 3 we o...,rabbits and rodents,rabbits and rodents_1,0.3694375,16,1,75
136,B0002ASMJO,Sun Seed Critter Cubes - 2 lb.,Sun Seed Critter Cubes - 2 lb....,rabbits and rodents,rabbits and rodents_3,0.3715,2,1,75
4200,B00IZFJHM4,Bonka Bird Toys 1717 Shoo Shred Bird Toy parrot craft cage cages cockatiels budgies parrotlets. Quality Product Hand Made in The USA.,"1717 Shoo shred, a delightful ...",bird,bird_0,0.7434333333333334,6,1,75
198,B0002E7JBW,NewLife Spectrum Large Fish Formula 3mm Sinking Pellet Fish Food,Give your larger fish the nutr...,fish,fish_5,0.5961153846153845,65,1,75
356,B000QSN2CE,Penn-Plax Dora Mermaid,Penn-Plax Dora Mermaid Persona...,other,other_2,0.82145,2,1,75
2600,B01CDIHDAG,"Exo Terra Night-Glo Moonlight Lamp, 25-Watt (4 Pack)",The Exo Terra Night-Glo T10 Mo...,amphibians and reptiles,amphibians and reptiles_0,0.52584,5,1,75
327,B0009ET7SS,"Halo Liv-A-Littles Natural Treats For Dogs And Cats, Dinner Party Wild Salmon With Herb Seasoning, 2.7Oz",A healthy way to improve the t...,cat,cat_1,0.41825,2,1,75
232,B000BXV6FY,Friskies Seafood Variety Easy Carry Cube (32/5.5-oz cans),Friskies makes it easier to fe...,cat,cat_3,-0.0136333333333333,3,1,75
90,B0002APINC,"Cichlid Trace, 250 mL / 8.5 fl. oz.",Cichlid Trace supplies a broad...,fish,fish_3,0.5862714285714284,7,1,75
267,B000LNMSC4,Imperial #bm0096 8&quot; 24ga Black Collar,"8"" 24 GA Black Stove Pipe Coll...",other,other_1,0.7047,2,1,75
2,B00005OMWL,ARK NATURALS Omerga Mender.,Ark Naturals Omega Mender! Itc...,cat,cat_6,0.1077142857142856,7,1,75
977,B000HCGWE4,Ultimate Touch Massaging Brush,Ultimate Touch Massaging Brush...,dog,dog_1,0.6698333333333334,6,1,75
14898,B00RLBEHNC,niceeshop(TM Deer Shape Cozy Puppy Kitten Pet Dog Cat Cotton Bed Nest Cave,Length:44cm/17.3inch;Width:46c...,cat,cat_0,0.6036545454545454,11,0,76
9582,B01D0Q2EMW,10 S+ Grade CBS Crystal Black Shrimp Live Freshwater Aquarium Shrimp - 1/4 to 1/2 inch long by SoShrimp,Scientific Name: Caridina cant...,rabbits and rodents,rabbits and rodents_0,0.6937,8,1,76
173,B0002DIKG6,Brown's Extreme Spicy Santa Fe Parrot Treat,Jam-packed with everything und...,bird,bird_4,0.39526,5,1,76
145,B0002ARY7U,Wardley,Wardley Algae Discs are ideal ...,fish,fish_3,0.4507358490566037,53,1,76
28,B000256EJE,"KORDON  #39446  100% Natural and Herbal Formula Ich Attack-Ich Treatment for Aquarium, 16-Ounce",Kordon ich-attack is one of th...,fish,fish_4,0.2092018348623852,109,1,76
301,B0002DIPLQ,Prevue Pet Products Charleston Bird Cage 110B,Prevue Pet Products Lincoln bi...,bird,bird_3,0.7330866666666667,15,1,76
815,B002VFI26Q,Word Balloon Stickers   (4 Shs/Pkg),Beistle 57065 Word Balloon Sti...,other,other_4,0.62275,2,1,76
2076,B00999EPTU,Rockin' Doggie's Saint Francis of Assisi- Light Blue,Great for cats and dogs. Size ...,dog,dog_3,0.8852,4,1,76
6381,B0145EIZSK,Luffy Marimo Moss Ball Premium Quality (0.5 inch) - Live Aquarium Aquatic Plant for Fish/shrimp Tank (USA) for Discus Betta Decor Ornament Crystal Algae Aegagropila.suitable for Coral Reef Brackish Water Aquarium/ Terrarium Too.,You are winning 5+1 Luffy Nano...,fish,fish_0,0.8291999999999999,8,0,76
4191,B0062Y0SQE,LupinePet Originals 1/2&quot; Bling Bonz Step In Dog Harness,All Lupine products are proudl...,dog,dog_1,0.7581333333333334,6,1,76
1374,B005CSFYT2,3 Lbs Tasty Dried Mealworms GMO FREE,Freeze Dried Mealworms are an ...,farm animals,farm animals_0,0.7061714285714286,7,1,76
366,B0002ZS302,Lixit Water Fount with Base - 32 oz,New self-refilling small anima...,cat,cat_2,0.7615666666666666,3,1,76
39,B0002APQ3E,Cat Allergy Reducing Wipes - .75&quot; X 5&quot; X 12&quot;,These Quick and easy to use pr...,cat,cat_4,0.805725,4,1,76
176,B0002DJDLW,Penn Plax Cascade 1200 / 1500 GPH Canister Filter Aquarium Bio Sponge Replacement; 1 Pack,The Penn Plax Cascade 1200/150...,fish,fish_5,0.4494125,32,1,76
506,B001CCNJBW, Pure-Ness Drawstring Cat Pan Liners,Extra giant drawstring pan lin...,other,other_3,0.4363,2,1,76
1077,B003LUYTQM,"Editex Home Textiles Monique Sheer Window Panel, 55 by 84-Inch, Fuchsia",Editex Home Curtains Was Found...,other,other_6,0.8791,2,1,76
55,B00025YRJS,Boyd Enterprises Chemi-Clean - 2 g,From the makers of Chemi-pure....,fish,fish_6,0.3589995391705067,217,1,76
41,B0002AQUHK,"Living Sea Hydrometer, Celsius &amp; Fahrenheit, Small, 8 Inches",The Living Sea Hydrometer is i...,rabbits and rodents,rabbits and rodents_1,0.26633,20,1,76
107,B00027ZWPO,Red Sea Flora Base Plant Aquarium Substrate,"In nature, aquatic plants flou...",rabbits and rodents,rabbits and rodents_4,0.9545,1,0,76
628,B00251NKTU,"IMAX 47126-2 Byzantine Dome Bird Cages, Set of 2","Byzantine Dome Bird Cages, Set...",other,other_5,0.6294500000000001,2,1,76
99,B0002AQMU0,Kaytee Supreme Bird Food For Cockatiels,Kaytee Supreme Cockatiel food ...,bird,bird_1,0.4370532110091742,109,1,76
198,B0006JLPFE,"Hydor MINI HEATER Aquarium Heater 7.5 Watts,  2-5 gal",Mini Aquarium Heater helps inc...,rabbits and rodents,rabbits and rodents_5,0.5529163398692812,153,1,76
644,B000X86SZU,Nature&amp;apos;s Variety Instinct Ultimate Protein Grain Free Chicken Dry Cat Food 5lbs,Nature's Variety Instinct Ulti...,cat,cat_5,-0.8862,1,1,76
417,B00106X52I,"Jurassipet Hermit Clean, 100 mL / 3.4 fl. oz.",All Natural Lime Scented Odor ...,other,other_2,0.83115,2,1,76
20789,B00J9NB5QW,"ChapStick Limited Edition Pomegranate Gumdrop, 0.15oz",.15 oz limited edition Pomegra...,other,other_0,0.6579999999999999,8,1,76
286,B000WJIJ1Q,Wysong Pet Nutritional Products 858316 21 Count Dream Chicken Treats For Pets,<br><br>Wysong Daily Dream Chi...,cat,cat_6,0.7217363636363636,11,1,76
11723,B0090AXSB4,Greenies Peanut Butter Dog Pill Pockets for Tablets 2.4Lbs (12 x3.2oz),Greenies Pill Pockets treats f...,dog,dog_6,0.5932875,8,1,76
119,B0002H3RRO,Vo-Toys Latex Stuffed Gigantic Yellow Hippo Dog Toy,Latex material. Safe squeak to...,dog,dog_5,0.85375,4,1,76
1778,B001RRWM5G," Higgins 466201 Higg Mh Yuca For Small Hookbill, 20 Lb ",Named after the lost civilizat...,bird,bird_0,0.7098666666666666,6,1,77
283,B000N0C794,Tunze USA 0220.560 Magnetic Glass Cleaner,The TUNZE magnetic pane cleane...,other,other_1,0.92765,2,1,77
149,B0002DI2MI,TetraFin Goldfish Crisps Clear Water Advanced Formula,TetraFin Goldfish Crisps conta...,fish,fish_6,0.4920987096774191,155,1,77
65,B0002ASAV4,Superpet (Pets International) SSR62104 Ferret Shake and Roll Toy,"Superpet ferret shake, rattle ...",rabbits and rodents,rabbits and rodents_1,0.19554,5,1,77
556,B000WFS2NK,"Diamond Puppy Biscuits, Golden Puppy, 20 Pound Bag",Diamond Super Premium Biscuits...,dog,dog_4,0.471375,4,1,77
233,B0002DK03W,Perky-Pet 342 Quick-Fill Bird Seed Scoop,The Perky-Pet Quick Fill Seed ...,bird,bird_2,0.474198780487805,82,1,77
1483,B004LO7LVC,Petrodex Neon Toothbrush,To help keep your pets teeth c...,dog,dog_3,0.50715,4,1,77
35696,B00RO974Q8,"Fruitables Skinny Minis Chewy Dog Treats in Grilled Bison Flavor,",...,dog,dog_0,0.6677714285714285,14,0,77
3715,B005N0CVAE,Life is Good Lucky Dog Bandanas,"The holiday plaid ""lucky dog"" ...",dog,dog_2,0.801742857142857,7,1,77
155,B0002AQGC4,Elite Maxima Deluxe Pump (Dual Outlet),The Elite Maxima Deluxe Pump i...,rabbits and rodents,rabbits and rodents_4,-0.5267,1,0,77
662,B001LUHHV8,"Brightwell Aquatics 8.5 fl. oz. Florin-Fe Ferrous and Ferric Iron for Planted FW Aquaria, 250 mL",Provides both ferrous (Fe2+) a...,other,other_4,0.7888,2,1,77
365,B000GKB3G4,NaturFiber 14 oz by Carefree Pet,Azmira&apos;s Natur Fiber is n...,dog,dog_5,0.6859,4,1,77
1267,B007P0IDNO,"1000ct Live Waxworms, Pet Food, Fishing",Live Wax Worms...,amphibians and reptiles,amphibians and reptiles_0,0.61416,5,1,77
21431,B01G5I5VMM,"Cat Sip 99781 Real Milk Treat For Cats And Kittens (12 Pack), 8 Oz",Cat Sip Real Milk Treat for Ca...,cat,cat_0,0.6193909090909092,11,1,77
33,B00025K0QW,San Francisco Bay Brand Freeze Dried Brine Shrimp 85g,Have a finicky eater? It will ...,fish,fish_5,0.5748944444444446,18,1,77
822,B000UJXIQE,"Dave'S Pet Food Natural Health Cat Food, 8 Lb",Dave's Naturally Healthy Adult...,cat,cat_1,0.873,2,1,77
620,B001VA6ETE,LupinePet 3/4&quot; Trail Mix 9-14 Adjustable Dog Collar,Lupine Adjustable Dog Collars ...,other,other_3,0.77675,2,1,77
155,B0002DGSTW,Gimborn Products SRD7555 24-Pack Small Animal Salt Wheel Counter Box,Gimborn salt wheel counter box...,rabbits and rodents,rabbits and rodents_3,0.7574000000000001,2,1,77
261,B000G0P3TM,"Richell Wood Pet Food Pedestal, Small, Autumn Matte Finish","Wood Pet Food Pedestal, Small,...",cat,cat_3,0.704190909090909,11,1,77
47,B0002AQ3EK,Prevue Pet Products Parrot Cage,Prevue Pet Products Parrot Cag...,bird,bird_6,0.6771478260869565,23,1,77
25,B0002A5ZF8,"Lee's Kritter Krawler Standard Exercise Ball, 7-Inch, Colored , Colors may Vary",Lee's Kritter Krawler Exercise...,rabbits and rodents,rabbits and rodents_5,0.4290120689655172,58,1,77
25,B000084EYZ,Precise Plus Feline Adult Formula,Precise Plus Feline Adult Form...,cat,cat_5,0.9143,1,1,77
75,B0002AS71W,Wet and Wild Stingray Aquarium Ornament,...,fish,fish_4,0.50554,5,1,77
544,B001FDRFMW,Bumble BEE Pet CostumeMedium by masterpet,"13""- 16"" Medium Pet

Cocker Sp...",other,other_5,0.4641,2,1,77
89,B0002APIMI,Seachem Reef Dip 250ml,Reef dip contains elemental io...,fish,fish_3,0.4280280000000001,25,1,77
361,B000RP5XBE,"K&amp;A Imports Fishing Boat, Extra Large",K&A's unique ornaments are per...,other,other_2,0.87985,2,1,78
71,B0002AQZKW,Animate Cat Flap ANI209,"Kitty in, kitty out. No more k...",cat,cat_5,0.8985,1,1,78
503,B001DCA7AC,"Tunze USA 6085.000 Stream Propeller Pump for Aquariums, Up to 265-Gallon",Stream pump 6085 is for aquari...,other,other_1,0.7879,2,1,78
9173,B005LEIRRS,Powzer Dual Ball Thrower,Powzer dual ball thrower...,dog,dog_6,0.8517125,8,1,78
92,B0002E7IWM,New Life Spectrum Discus 250g,&quot;New Life Spectrum food i...,fish,fish_4,0.41823,10,1,78
204,B0002AXGOK,Prevue Pet Products Hooded Ceramic Cup Assorted Colors Small 4.2 oz,Holds 4 oz. Assorted colors Pr...,bird,bird_3,0.6293200000000001,5,1,78
175,B000IZX1LC,"Petmate Kitty Komplete Jumbo Hooded Litter Pan and Hood, Peacock/Slate",Petmate kitty komplete feature...,cat,cat_6,0.5096520249221183,321,0,78
266,B0002FP3OG,Goldenfeast Veggie Crisp Delite 17 oz.,Goldenfeast Veggie Crisp Delit...,bird,bird_4,0.38945,8,1,78
121,B0002ARVKU,"Cockatiel Staple Vme Seed, 5-Pound",Hagen cockatiel seed contains ...,bird,bird_1,0.6395000000000001,8,1,78
38,B0002568AE,Zoo Med 18 Inch Reef Sun Flourescent Bulb (T8 STD Output),Our Reef Sun bulb has a 50/50 ...,fish,fish_6,0.3821571428571429,14,1,78
115,B0002DK2LW,Small Animal Habitat - NO MESS HALL,Small Animal Habitat by Penn P...,rabbits and rodents,rabbits and rodents_1,0.67305,4,1,78
4198,B004UIB0XE,Frankenstein Iron on Patch Classic Monster Movie Occult,Add Frank to your clothing or ...,other,other_0,0.7028125000000001,8,1,78
36253,B00SDVTSRO,"KONA'S CHIPS 2 Pack BITS-O- Chips 8 oz; Dog Treats Made in USA ONLY &ndash; 100% USDA Chicken, All Natural, Healthy &amp; Safe Treats for Your Dog. Smaller Jerky Pieces for Small Dogs.",The Small Dog's Favorite!<br><...,dog,dog_0,0.7303071428571428,14,1,78
387,B000FQ2N5Y,Ty Charm - Frog with Crown,"Ty Charm - Frog with Crown,You...",amphibians and reptiles,amphibians and reptiles_0,0.57864,5,1,78
3,B000084E5W,Petmate Litter Pan Assorted Large,With Microban antimicrobial. D...,cat,cat_4,0.6527250000000001,4,0,78
138,B0002ML8CA,Newman's Own Organics Adult Dry Dog Food,"For the past 20 years, Newman&...",dog,dog_3,0.748325,4,1,78
276,B0002DKBY0,"Ware Manufacturing Cattachment Fuzz E Bed Cat Bed Cover, Fits 14-Inch",Ware Manufacturing's Cattachme...,cat,cat_2,0.6695333333333333,3,1,78
111,B000A6VOZ4,Select the Best Nu-image,RICHDEL 784299040502 Nu-Image ...,farm animals,farm animals_0,0.6920285714285715,7,1,78
683,B000P695M8,"Eco Labs MLLFGMD Fruits and Greens Koi and Goldfish Food, 2-Pound",Supplemental food for feeding ...,fish,fish_0,0.4438749999999999,8,1,78
25,B000256962,Seachem Flourish Excel Bioavailable Carbon for The Planted Aquarium,Flourish excel is a simple sou...,fish,fish_5,0.4720997315436244,745,1,78
3415,B005FH2Q28,Marine Calcium Checker HC Reagents (25 Tests) - HI758-26,Marine Calcium Checker HC Reag...,rabbits and rodents,rabbits and rodents_0,0.6611875,8,1,78
215,B0009SQEGW,Kitty A GoGo Cat Litter Box - Polka Dot,Kitty A GoGo Designer Litter B...,other,other_4,0.8371,2,1,78
142,B0002ARMQS,"Blue Ridge Fish Food Pellets | Koi and Goldfish Growth Formula | Floating Mini Pellet, Balanced Diet",Blue Ridge Growth Formula Koi ...,fish,fish_3,0.477774074074074,27,1,78
588,B0006FMVMO,YML 3/8 in. Pagoda Top Bird Cage,1644 Brand New Villa Top 16x16...,rabbits and rodents,rabbits and rodents_4,0.9477,1,1,78
4708,B0080P7W94,"Coastal Pet Products, Inc. 14601 18 Inch x 3/4 Inch Soy Collar - Forest Green",It's a Natural Choice! Made of...,dog,dog_1,0.8634333333333334,6,1,78
219,B0007OPW02,Chick O Stick Medium,Just imagine the best fresh-ro...,other,other_6,0.9417,2,1,78
4594,B001C8IDXA,Lambert Kay Fresh 'N Clean Scented Pet Shampoo 16oz,"Fresh 'n Clean Pet Shampoo, 18...",dog,dog_6,0.842325,8,1,79
17573,B013S3SQBA,Personalized Pet Stone Memorial Marker Granite Marker Dog Cat Horse Bird Human 6&quot; X 10&quot; Personalised Miniature Schnauzer Husky,Our Stones tell a Story. Perso...,cat,cat_0,0.7988909090909092,11,1,79
201,B0002DHZK8,Petmate Cabin Kennel with Wire Top for Small Pets,One year manufacturer's warran...,bird,bird_2,0.77162,15,1,79
196,B000EB7ER2,Sports Ball Tug Toys-SOCCER,...,other,other_1,0.5917,2,1,79
137,B0002AT7IO,Exotic Environments Forgotten Ruins Aquarium Ornament,Exotic Environments Forgotten ...,fish,fish_6,0.6043375000000002,40,1,79
124,B0002AQONA,Fluval Foam Pad - 2-Pack,Fluval C2 Foam Pads Replacemen...,fish,fish_3,0.5871850000000001,20,1,79
39675,B00VQEUS42,Kirei Sui Royal Blue Rosettes Pets Tutu Party Dress,"[XS] Length 22CM , Bust 30CM [...",dog,dog_0,0.6547214285714286,14,1,79
4,9828377306,Birds LOVE Totem Pole Bird Toy,Graham's Parrot Toy Creations ...,bird,bird_6,0.5922321428571429,28,1,79
616,B000W7IQOS,"Signature Sorrento Extra-Small 5-Inch Pet Bowl, Ivory",The Signature Sorrento Extra S...,cat,cat_5,0.983,1,0,79
2584,B00BRNGTPY,Zymox Enzymatic Shampoo (Gallon),",<b> FurryPals Gentle and Natu...",dog,dog_5,0.700875,4,0,79
2322,B004DEDJF2,"Cole's SF10 Special Feeder, 10-Pound",Special feeder has all of the ...,bird,bird_0,0.5972166666666666,6,1,79
220,B000B9SFLQ,Miller Plastic Feed Scoop,Plastic Feed Scoop One piece m...,cat,cat_3,0.5682545454545455,11,1,79
81,B0002ASBUO,Kaytee Me Travel Carrier,Kaytee Take Me With Travel Car...,rabbits and rodents,rabbits and rodents_5,0.4645499999999998,118,1,79
569,B000633R3I,PETCO Furry Mice Cat Toys,PETCO Furry Mice Cat Toys...,rabbits and rodents,rabbits and rodents_4,0.8589,1,0,79
268,B000CQSE64,Lawrence Tender Care Slicker Medium,The Lawrence Tender Care Slick...,other,other_3,0.92465,2,1,79
107,B0002AQJHG,Marina 3-Inch Blue Fine Nylon Net with 10-Inch Handle,The Marina Fish Net provides a...,fish,fish_5,0.4677937198067632,207,1,79
1504,B001U6IQFY,"Ocean Nutrition Atisons Betta Pro Food, 7 grams",Ocean Nutrition provides quali...,fish,fish_0,0.5769,8,1,79
5450,B00AW2WMZC,Loving Pets Barksters Sweet Potato &amp; Beef Krisps 2.5Lbs (8 x 5oz),Barksters was born from a simp...,dog,dog_2,0.6052285714285714,7,1,79
56,B0002AQWUA,PowerFlo Biological Add-on Filter Chamber,Add to any powerflo internal p...,other,other_5,0.79365,2,1,79
781,B000RYFJRI,Fancy Feast Chunky Chicken Feast Cat Food 3 oz (Pack of 24),Fancy Feast.<br>Chicken feast ...,cat,cat_1,0.8212999999999999,2,1,79
43,B00025YVHG,API ALGAEFIX Algae Control Solution,Treat and control algae growth...,fish,fish_4,0.123250091743119,545,1,79
269,B00061MROA,Bene-Bac Pet Gel 4-Pack - Four 1g tubes,Bene-Bac Pet Gel is a concentr...,rabbits and rodents,rabbits and rodents_3,0.4752574468085106,47,1,79
1364,B003AVKLZK,Chris Christensen After U Bathe Final Rinse Solution Gallon,Chris Christensen After U Bath...,dog,dog_4,0.7696,4,1,79
572,B001G8PRHQ,"Boxer Uncropped Dog - Linda Picken Treat Jar,BOB"" />",The Ceramic Dog Treat Jar is a...,other,other_2,0.76475,2,1,79
4306,B006FQIYWE,"Dad' Products Doggie Quartets Assortment, 62.5 Ounce",Assorted savory dog snacks...,dog,dog_1,0.5423333333333333,6,1,80
368,B000UJXFAI,"Fashion Pet Outdoor Dog Plaid Fleece Jacket, X-Small, Pink",This Reversible printed plaid ...,other,other_5,0.58315,2,1,80
1117,B000RYDMKO,"Friskies Cat Food Turkey &amp; Giblets Dinner, 5.5 oz",Purina Friskies Special Diet T...,cat,cat_2,0.2758,3,1,80
1742,B005MZ5YE0,"East Side Collection Acrylic Spirit Dog Sweater, Polka Dot, Small/Medium, 14-Inch",This cheerful spirit dog sweat...,dog,dog_3,0.8210000000000001,4,1,80
1440,B003TM9HIW,"Dean and Tyler Nocturne Dog Leash, Black 6-Feet by 1/2-Inch Width With Solid Brass Hardware.",Dean and tyler dog leather lea...,dog,dog_4,0.7651249999999999,4,1,80
369,B0002DIYGM,Prevue Pet Products Rainbow Mini Acrylic Rattle Bird Toy,Mini acrylic toys are designed...,rabbits and rodents,rabbits and rodents_4,0.8549,1,0,80
